section	web_url	pub_date	snippet
Business	https://mediadecoder.blogs.nytimes.com/2013/02/20/conan-obrien-to-host-white-house-correspondents-dinner/	2013-02-20T11:17:00Z	The choice of hosts at the dinner has veered from safe (Jay Leno) to near-scandalous (Stephen Colbert).
Business	https://mediadecoder.blogs.nytimes.com/2013/02/20/the-breakfast-meeting-a-childrens-app-breaks-ground-for-viacom-and-essay-on-royals-causes-uproar/	2013-02-20T08:36:51Z	Nickelodeon's plans for an iPad app could mean big things for Viacom, an article by Hilary Mantel about the former Kate Middleton draws a response on The Daily Mail's front page and an attempt to subpoena outtakes from a Ken Burns documentary fail...
Business	https://mediadecoder.blogs.nytimes.com/2013/02/20/robin-roberts-returns-to-good-morning-america/	2013-02-20T07:05:18Z	Robin Roberts, who took a leave to fight a life-threatening illness, returned to “Good Morning America” on Wednesday.
Business	https://mediadecoder.blogs.nytimes.com/2013/02/19/downton-finale-seen-by-8-2-million-viewers/	2013-02-19T19:04:02Z	Sunday's audience surpassed even the audience for the third season premiere in January, when about 7.9 million viewers tuned in, a 20-year record for PBS.
Business	https://mediadecoder.blogs.nytimes.com/2013/02/19/f-b-i-file-on-times-publisher-was-destroyed-before-his-death/	2013-02-19T17:32:04Z	Arthur Ochs Sulzberger, the Times publisher during whose long tenure the Pentagon Papers were published, had drawn the attention of federal investigators.
Business	https://mediadecoder.blogs.nytimes.com/2013/02/19/warner-music-makes-a-deal-with-small-labels/	2013-02-19T16:05:06Z	Warner, which acquired most of the EMI assets that Universal was ordered to dispose of last year, has struck an agreement with two independent trade groups to sell or license "a significant portion" of that music to small companies.
Business	https://mediadecoder.blogs.nytimes.com/2013/02/19/meteor-videos-set-online-viewing-record/	2013-02-19T15:55:15Z	An online measurement firm reported Tuesday that videos of last week's Russian meteor have collectively topped 138 million views on the video-sharing sites it tracks, like YouTube and DailyMotion. The firm said the meteor was "the fastest video ev...
Business	https://mediadecoder.blogs.nytimes.com/2013/02/19/jay-z-follows-top-publishing-executive-to-warner-music/	2013-02-19T13:55:51Z	Warner/Chappell has signed Jay-Z to a publishing administration deal for his future work as well as his music since 2008.
Business	https://mediadecoder.blogs.nytimes.com/2013/02/19/does-the-house-of-cards-all-you-can-eat-buffet-spoil-social-viewing/	2013-02-19T12:35:26Z	The great thing about Netflix's "House of Cards"? You can watch it all at once. That may be the bad thing, too. How do you gather around a water cooler and talk about a moving target?
Business	https://mediadecoder.blogs.nytimes.com/2013/02/19/nbc-news-hires-david-axelrod-as-political-analyst/	2013-02-19T11:16:59Z	The chief political strategist for both Obama presidential campaigns will appear on NBC and MSNBC
Business	https://mediadecoder.blogs.nytimes.com/2013/02/19/the-breakfast-meeting-nascar-tries-to-expand-its-audience-and-esquire-network-defines-the-modern-man/	2013-02-19T08:57:19Z	Nascar tries to captivate a younger, urban, multicultural audience; the Esquire Network tries to define and cater to that inscrutable creature, the modern man; and First Response pregnancy tests advertise for a Spanish-speaking audience for the fi...
Business	https://mediadecoder.blogs.nytimes.com/2013/02/19/ford-turns-to-the-crowd-for-new-fiesta-ads/	2013-02-19T00:01:20Z	Executives of Ford Motor Company plan to announce on Tuesday that they intend to recruit 100 socially-connected consumers to produce a year's worth of advertising for the next Fiesta.
Business	https://mediadecoder.blogs.nytimes.com/2013/02/18/hong-kong-disneyland-turns-a-profit/	2013-02-18T11:57:21Z	The Walt Disney Company on Monday said that its seven-year-old theme park and resort complex in Hong Kong turned a profit for the first time following an aggressive expansion costing several hundred million dollars.
Business	https://mediadecoder.blogs.nytimes.com/2013/02/18/first-response-targets-spanish-language-tv/	2013-02-18T09:00:56Z	On Monday, the brand will, for the first time, advertise its pregnancy test and ovulation prediction kit to a Spanish-speaking audience on television networks that include Univision, Galavision, Telemundo and MTV Tres.
Business	https://mediadecoder.blogs.nytimes.com/2013/02/18/the-breakfast-meeting-the-tech-industry-looks-to-online-gambling-and-business-insider-appoints-an-executive-editor/	2013-02-18T08:43:52Z	The technology industry has set its sights on online gambling, Business Insider names Joe Weisenthal as executive editor and authenticating an online photo in Omaha takes more shoe leather than tech savvy.
Business	https://mediadecoder.blogs.nytimes.com/2013/02/17/business-site-elevates-an-editor/	2013-02-17T20:18:02Z	The founder of Business Insider, the online news franchise, promoted a managing editor into the new position of executive editor to help handle the site's growth.
Business	https://mediadecoder.blogs.nytimes.com/2013/02/17/dog-experts-dos-and-donts-for-pet-owners-in-china/	2013-02-17T18:30:47Z	Cesar Millan, the star of the "Dog Whisperer" television series, is planning an extensive celebrity branding campaign in China.
Business	https://mediadecoder.blogs.nytimes.com/2013/02/15/cnn%e2%80%99s-carnival-cruise-ship-coverage-lifts-ratings/	2013-02-15T19:11:35Z	The channel, which usually loses to MSNBC and Fox News on a daily basis, easily beat MSNBC and came much closer to Fox than it usually does.
Business	https://mediadecoder.blogs.nytimes.com/2013/02/15/music-companies-fight-over-the-scraps-of-emi/	2013-02-15T18:25:38Z	Sanctuary Records, which owns classic albums by the Kinks and Black Sabbath, was snapped up by BMG Rights.
Business	https://mediadecoder.blogs.nytimes.com/2013/02/15/this-american-life-looks-at-a-high-school-marooned-in-violence/	2013-02-15T12:49:26Z	At Chicago's Harper High School, 29 current or former students were shot last year. "This American Life" spent five months at the school, and begins a two-part special report this weekend.
Business	https://mediadecoder.blogs.nytimes.com/2013/02/15/campaign-promotes-new-bank-service-for-nba-fans/	2013-02-15T09:00:18Z	BBVA Compass, the American franchise of the Spanish bank, and the NBA will unveil a campaign on Friday to promote online consumer checking and savings accounts.
Business	https://mediadecoder.blogs.nytimes.com/2013/02/15/the-breakfast-meeting-cbs-sets-earnings-record-and-publishing-merger-gets-o-k/	2013-02-15T08:27:20Z	CBS set records in the last quarter of 2012; the Justice Department has approved a merger of Random House and Penguin, possibly creating the largest book publisher in the world; and Time Warner's efforts to push Time Inc. out the door like a waywa...
Business	https://mediadecoder.blogs.nytimes.com/2013/02/14/studios-have-differing-responses-to-visual-effects-companys-financial-woes/	2013-02-14T18:53:20Z	Two studios that are supplied by the company, called Rhythm and Hues, are extending credit, but a third, Warner Brothers, is not.
Business	https://mediadecoder.blogs.nytimes.com/2013/02/14/cbs-reports-record-quarterly-operating-income-for-fourth-quarter-of-2012/	2013-02-14T18:38:31Z	Although the company's overall results improved in most financial categories and divisions, they fell short of some analysts' expectations.
Business	https://mediadecoder.blogs.nytimes.com/2013/02/14/for-cnn-cruise-ship-coverage-by-air-land-and-sea/	2013-02-14T14:09:51Z	The cable news channel threw everything it had on Thursday at the odyssey of the Carnival Cruise Line ship Triumph, which was being towed toward port in Mobile, Ala., after four days stranded at sea.
Business	https://mediadecoder.blogs.nytimes.com/2013/02/14/justice-department-approves-random-house-penguin-merger/	2013-02-14T13:11:20Z	The two publishing companies cleared an important hurdle in their effort to merge when the Justice Department said it was ending its review of the deal "without conditions.''
Business	https://mediadecoder.blogs.nytimes.com/2013/02/14/time-inc-the-unwanted-party-guest-being-pushed-out-the-door/	2013-02-14T11:02:55Z	Time Inc. has been an integral part of the Time Warner brand, but it long ago lost salience as a significant component in the company's business.
Business	https://mediadecoder.blogs.nytimes.com/2013/02/14/the-breakfast-meeting-time-warner-considers-shedding-some-magazines-and-panera-appeals-to-consumers-decency/	2013-02-14T08:42:10Z	Time Warner may spin off most of Time Inc.'s magazines in a deal with Meredith Corporation; Panera Bread Bakeries is the latest company to appeal to consumers through good works; and discussions of the sounds and near-silence of "Life of Pi."
Business	https://mediadecoder.blogs.nytimes.com/2013/02/13/barnes-noble-warns-of-lower-revenues/	2013-02-13T18:17:30Z	The nation's largest brick-and-mortar book retailer is warning that it will not meet expectations for another quarter.
Business	https://mediadecoder.blogs.nytimes.com/2013/02/13/manhunt-and-obamas-address-bolster-cnns-ratings/	2013-02-13T18:09:41Z	Over all, in terms of total viewers, the ratings for the speech were down on most of the networks that carried it, but CNN's viewership was up sharply, gaining 36 percent over the audience that viewed the speech a year ago.
Business	https://mediadecoder.blogs.nytimes.com/2013/02/13/indian-music-service-taking-page-from-spotify-goes-pro/	2013-02-13T16:52:39Z	Saavn, a Spotify-like service that specializes in Indian music, will begin offering a premium version at $4 a month.
Business	https://mediadecoder.blogs.nytimes.com/2013/02/13/time-warner-in-talks-to-sell-off-majority-of-magazines/	2013-02-13T15:41:15Z	Early discussions involve putting most of its titles — but not Time, Fortune or Sports Illustrated — into a separate company with Meredith magazines.
Business	https://mediadecoder.blogs.nytimes.com/2013/02/13/scott-brown-becomes-a-fox-news-contributor/	2013-02-13T15:12:36Z	Mr. Brown will make his debut as a paid pundit on Wednesday night's edition of "Hannity," the channel's 9 p.m. program.
Business	https://mediadecoder.blogs.nytimes.com/2013/02/13/after-cameo-poland-spring-uncaps-a-response/	2013-02-13T14:48:53Z	When Senator Marco Rubio, the Florida Republican, reached for a bottle of Poland Spring water on Tuesday night during the Republican response to President Obama's State of the Union address, social media exploded with mentions of the brand. Poland...
Business	https://mediadecoder.blogs.nytimes.com/2013/02/13/executive-steeped-in-print-joins-online-ad-venture/	2013-02-13T13:15:56Z	Steve Sachs, who held several top posts at the Time Inc. unit of Time Warner until he left almost a year ago, is joining OneSpot, a start-up based in Austin, Tex. that specializes in what is called content advertising.
Business	https://mediadecoder.blogs.nytimes.com/2013/02/13/the-breakfast-meeting-comcast-buys-rest-of-nbcuniversal-and-sites-that-appeal-to-book-lovers/	2013-02-13T09:11:39Z	Comcast bought the rest of NBCUniversal from General Electric for $16.7 billion; Web sites that help uncover new books, like Goodreads.com, have become indispensable for readers, writers and publishers; and Slacker, a digital music service, takes ...
Business	https://mediadecoder.blogs.nytimes.com/2013/02/12/comcast-buying-g-e-s-stake-in-nbcuniversal-for-16-7-billion/	2013-02-12T16:54:23Z	The purchase completes a sales process that was expected to take several more years.
Business	https://mediadecoder.blogs.nytimes.com/2013/02/12/don-johnson-settles-nash-bridges-lawsuit/	2013-02-12T14:45:53Z	The actor has accepted $19 million in a settlement with Rysher Productions, the company that produced his long-ago CBS crime series, "Nash Bridges."
Business	https://mediadecoder.blogs.nytimes.com/2013/02/12/slight-increase-in-average-movie-ticket-price/	2013-02-12T12:19:52Z	Moviegoers paid an average of $7.96 in 2012, a three-cent increase over the year before. But prices increases accelerated in the latter part of the year.
Business	https://mediadecoder.blogs.nytimes.com/2013/02/12/netflix-joins-with-dreamworks-animation-to-create-series-for-children/	2013-02-12T11:44:34Z	The two companies will combine on a show based on the studio's upcoming movie "Turbo.''
Business	https://mediadecoder.blogs.nytimes.com/2013/02/12/the-breakfast-meeting-amazon-challenges-netflix-and-an-advertiser-turns-to-cat-videos/	2013-02-12T08:26:52Z	Amazon.com is quietly building a library of exclusive online content to rival Netflix, the champion of streaming media; cat videos are used to sell things rather than simply distract; and a Japanese television show captures the angst of a major li...
Business	https://mediadecoder.blogs.nytimes.com/2013/02/11/univision-and-abc-news-give-details-of-cable-channel-aimed-at-latinos/	2013-02-11T18:37:25Z	The joint venture underscores the growing influence of the burgeoning Hispanic audience.
Business	https://mediadecoder.blogs.nytimes.com/2013/02/11/reality-show-cast-member-who-died-in-crash-was-special-forces-veteran/	2013-02-11T18:19:06Z	Michael Donatelli, 45, was a cast member of an as-yet-untitled reality show that was in production for the Discovery Channel.
Business	https://mediadecoder.blogs.nytimes.com/2013/02/11/walking-dead-sets-ratings-record-for-amc/	2013-02-11T16:21:24Z	The show returned Sunday night with an audience of 12.3 million total viewers.
Business	https://mediadecoder.blogs.nytimes.com/2013/02/11/digital-notes-the-scorecard-on-social-medias-grammy-predictions/	2013-02-11T14:21:32Z	Who did better in predicting the Grammy's -- social media, or traditional experts. It turns out that the score was about even.
Business	https://mediadecoder.blogs.nytimes.com/2013/02/11/grammy-awards-viewership-falls-sharply/	2013-02-11T13:32:53Z	The show took a steep fall from the huge audience it attracted last year, when it aired just a day after the death of Whitney Houston. But the broadcast still managed to draw a total of 28.37 million viewers, the second-best Grammy performance sin...
Business	https://mediadecoder.blogs.nytimes.com/2013/02/11/abc-wins-first-interview-with-amanda-knox/	2013-02-11T11:21:58Z	Diane Sawyer, the anchor of ABC's "World News," will conduct the interview of Ms. Knox, to be televised in prime time on April 30.
Business	https://mediadecoder.blogs.nytimes.com/2013/02/11/starz-extends-deal-with-sony-pictures/	2013-02-11T10:56:21Z	The pay cable channel has completed a deal with Sony Pictures Entertainment, extending an agreement for exclusive access to Sony movies through 2021.
Business	https://mediadecoder.blogs.nytimes.com/2013/02/11/amazon-and-cbs-announce-deal-on-rights-to-under-the-dome/	2013-02-11T10:23:33Z	Slowly but confidently, Amazon is building a library of television shows and movies to rival that of Netflix.
Business	https://mediadecoder.blogs.nytimes.com/2013/02/11/the-breakfast-meeting-folk-and-rock-are-ascendant-at-the-grammys-and-a-belated-focus-on-drones/	2013-02-11T08:16:36Z	The Grammy Awards celebrated rock and folk almost to the exclusion of other genres; current scrutiny of the government's drone program points out the lack of attention paid to it thus far; and NBC Universal will rebrand one of its cable channels t...
Business	https://mediadecoder.blogs.nytimes.com/2013/02/10/helicopter-crash-kills-3-tv-crew-members/	2013-02-10T21:16:21Z	The crash happened during filming for a reality TV show, and the incident could draw new scrutiny of production practices.
Business	https://mediadecoder.blogs.nytimes.com/2013/02/10/a-new-swimsuit-issue-feature/	2013-02-10T20:06:58Z	The popular annual issue will contain a style guide to help women recreate the looks in the magazine, and Target is a marketing partner.
Business	https://mediadecoder.blogs.nytimes.com/2013/02/10/npr-campaign-seeks-the-quirky-listener/	2013-02-10T18:25:38Z	The public radio network aims to match its shows to potential listeners with even the oddest interests.
Business	https://mediadecoder.blogs.nytimes.com/2013/02/10/warner-to-show-3-d-film-trailers-at-truck-stops/	2013-02-10T17:23:48Z	To advertise the 3-D effects of "Jack the Giant Slayer," the studio is buying space on Travel Plaza TV, distributed in about 300 gas stations and Pilot Flying J truck stops in 42 states.
Business	https://mediadecoder.blogs.nytimes.com/2013/02/08/after-just-two-episodes-nbc-cancels-do-no-harm/	2013-02-08T20:33:13Z	The premiere a week ago attracted the fewest viewers ever of any new network drama in a regular season -- just 3.1 million.
Business	https://mediadecoder.blogs.nytimes.com/2013/02/08/christina-applegate-leaves-up-all-night/	2013-02-08T18:48:03Z	Ms. Applegate announced Friday she has decided to quit the series on NBC rather than continue in a new format, which will transform the comedy from a single camera filmed show, to one filmed on tape in front of a studio audience.
Business	https://mediadecoder.blogs.nytimes.com/2013/02/08/aarp-will-embrace-lifes-possibilities-during-grammys/	2013-02-08T16:05:24Z	Its new campaign, with a budget estimated at $25 million to $30 million, will introduce the theme "Real possibilities."
Business	https://mediadecoder.blogs.nytimes.com/2013/02/08/citing-potential-damages-macmillan-settles-with-justice-department-on-e-book-pricing/	2013-02-08T11:02:55Z	Citing the potential cost of fighting and losing a government lawsuit, Macmillan agreed to terms similar to those imposed on other major publishers who had settled.
Business	https://mediadecoder.blogs.nytimes.com/2013/02/08/the-breakfast-meeting-oscar-race-beyond-the-grave-and-crowdsourcing-design/	2013-02-08T08:50:02Z	The fight to secure a place on the Oscar memorial list can be as contentious as trying to win an award, Alexander Wang teams up with Samsung to promote creativity and smartphones and whom to watch in this year's Grammy awards on Sunday.
Business	https://mediadecoder.blogs.nytimes.com/2013/02/07/a-fish-er-storm-named-nemo/	2013-02-07T18:45:58Z	The Weather Channel has bestowed storms with names like Athena, Caesar, Freyr, Iago, and Kahn. This one brings to mind the adorable orange fish in the Disney/Pixar film, "Finding Nemo."
Business	https://mediadecoder.blogs.nytimes.com/2013/02/07/documents-on-new-zealand-labor-talks-related-to-films-may-be-made-public/	2013-02-07T15:17:23Z	New Zealand's ombudsman has recommended that the government release the documents from 2010 that touch on negotiations with the director Peter Jackson and Warner Brothers over changes to the labor laws.
Business	https://mediadecoder.blogs.nytimes.com/2013/02/07/nbc-shuts-down-hyperlocal-web-site/	2013-02-07T14:05:03Z	EveryBlock, a pioneering Web site for hyperlocal data-driven journalism, shut down on Thursday, disappointing longtime fans.
Business	https://mediadecoder.blogs.nytimes.com/2013/02/07/led-by-celebrity-titles-magazine-newsstand-sales-slide/	2013-02-07T12:54:07Z	People, US Weekly, Cosmopolitan and Glamour all suffered double-digit decreases in the second half of 2012.
Business	https://mediadecoder.blogs.nytimes.com/2013/02/07/warner-music-group-buys-emi-assets-for-765-million/	2013-02-07T11:57:17Z	Warner will now own Parlophone, the historic label that is home to Coldplay, Blur and Kylie Minogue.
Business	https://mediadecoder.blogs.nytimes.com/2013/02/07/new-novel-takes-readers-downstairs-at-longbourn/	2013-02-07T10:14:04Z	Jo Baker's tale of the servants in "Pride and Prejudice'' drew frenetic bidding among publishing houses when it was offered last week.
Business	https://mediadecoder.blogs.nytimes.com/2013/02/07/the-breakfast-meeting-cable-lifts-earnings-at-time-warner-and-news-corp-and-the-surprise-seller-of-a-malibu-mansion/	2013-02-07T09:10:50Z	Strong cable television gains prove a boon for Time Warner and News Corp, the owner of a rather gaudy $25 million home that hit the market in Malibu may surprise you and Melena Ryzik chats with Steven Spielberg about the difficulties of filming "L...
Business	https://mediadecoder.blogs.nytimes.com/2013/02/06/news-corp-posts-gain-on-strength-of-cable-channels/	2013-02-06T18:30:08Z	On Wednesday, the company reported net income of $2.38 billion, or $1.01 a share, compared with $1.06 billion, or $0.42 a share in the same three-month period a year earlier.
Business	https://mediadecoder.blogs.nytimes.com/2013/02/06/magazines-react-to-post-office-cutbacks-the-friday-evening-post/	2013-02-06T15:50:03Z	The loss of Saturday delivery are another blow for the industry, particularly affecting the newsweeklies and celebrity magazines like People.
Business	https://mediadecoder.blogs.nytimes.com/2013/02/06/smash-premiere-falls-short-loses-viewers/	2013-02-06T13:17:38Z	The show, which was extensively retooled by NBC after a disappointing season, fell a staggering 71 percent in viewership from its opening episode last season.
Business	https://mediadecoder.blogs.nytimes.com/2013/02/06/things-get-rough-on-twitter-over-gun-debate/	2013-02-06T13:16:14Z	Things got ugly on Twitter after the editor of Mother Jones tweeted about the murder of a former sniper over the weekend.
Business	https://mediadecoder.blogs.nytimes.com/2013/02/06/cable-tv-revenues-helps-spur-time-warner-profit/	2013-02-06T12:23:31Z	The revenue from ads and subscription fees from its cable properties helped overcome a challenging quarter for the media conglomerate's publishing and movie divisions.
Business	https://mediadecoder.blogs.nytimes.com/2013/02/06/replaying-super-bowl-ads-effectiveness/	2013-02-06T10:47:34Z	Myriad analyses, polls and surveys of consumer responses to the Super Bowl commercials scrutinize the biggest day of the year in advertising.
Business	https://mediadecoder.blogs.nytimes.com/2013/02/06/fox-news-and-dick-morris-part-ways/	2013-02-06T10:19:31Z	The Fox News Channel has declined to renew its contract with Mr. Morris, three months after he was widely derided for predicting a landslide victory for Mitt Romney in the Nov. 6 presidential election.
Business	https://mediadecoder.blogs.nytimes.com/2013/02/06/the-breakfast-meeting-liberty-global-buys-virgin-media-and-how-to-talk-about-house-of-cards-sans-spoilers/	2013-02-06T08:30:03Z	Liberty Global is buying Virgin Media for about $16 billion, spoiler concerns after the simultaneous release of all 13 episodes of "House of Cards" on Netflix, and the Church of Scientology's Super Bowl ad.
Business	https://mediadecoder.blogs.nytimes.com/2013/02/06/shazam-expands-catalog-through-deal-with-online-dance-store-beatport/	2013-02-06T08:00:15Z	The popular song identifying app will now work at the nightclub as well as in the car.
Business	https://mediadecoder.blogs.nytimes.com/2013/02/05/twitter-buys-company-that-mines-chatter-about-tv/	2013-02-05T19:26:59Z	Twitter is buying Bluefin Labs, which analyzes online chatter about TV shows and sells its findings.
Business	https://mediadecoder.blogs.nytimes.com/2013/02/05/costs-at-espn-depress-disney-profits/	2013-02-05T17:08:57Z	Increases in costs for programming like basketball and football at ESPN provided a drag on the results from Disney’s media networks unit.
Business	https://mediadecoder.blogs.nytimes.com/2013/02/05/sirius-reports-revenue-and-subscriber-growth-in-2012/	2013-02-05T13:51:50Z	Price increases didn't hamper subscriber growth at the satellite radio company, which is offering new services to compete with the likes of Pandora.
Business	https://mediadecoder.blogs.nytimes.com/2013/02/05/apple-to-highlight-self-published-books/	2013-02-05T10:32:22Z	The Apple iBookstore will feature a grouping of self-published books titled "Breakout Books.''
Business	https://mediadecoder.blogs.nytimes.com/2013/02/05/the-breakfast-meeting-super-bowl-ads-hewed-to-the-sentimental-or-comical-and-muzak-faces-the-music/	2013-02-05T08:58:42Z	Most Super Bowl ads tried for either humor or sentimentality; the Muzak name is going away, but not necessarily the music; and an NBCUniversal executive moves up.
Business	https://mediadecoder.blogs.nytimes.com/2013/02/04/bookish-new-web-site-provides-information-on-books-and-authors/	2013-02-04T21:41:17Z	The site will provide content about books in a literary magazine-like format, with a diverse range of articles. It also has a new book recommendation engine.
Business	https://mediadecoder.blogs.nytimes.com/2013/02/04/hammer-given-authority-over-nbcs-cable-entertainment-channels/	2013-02-04T15:57:47Z	The company placed the new entity under Bonnie Hammer, head of the USA Network and other cable channels, making her one of the more powerful women in television.
Business	https://mediadecoder.blogs.nytimes.com/2013/02/04/fox-news-monitors-geraldo-as-he-mulls-political-office/	2013-02-04T13:24:03Z	Mr. Rivera, a longtime commentator and reporter, has said that he's interested in running for the Senate in New Jersey.
Business	https://mediadecoder.blogs.nytimes.com/2013/02/04/blackout-is-a-boon-for-super-bowl-ratings/	2013-02-04T10:28:57Z	The interruption was not only a diversion, but also changed the momentum in the game, helping to retain an audience that otherwise might have tuned out.
Business	https://mediadecoder.blogs.nytimes.com/2013/02/04/the-breakfast-meeting-disappointing-super-bowl-ads-and-a-hollywood-outsider-makes-his-move/	2013-02-04T09:10:49Z	A critique of the Super Bowl ads finds them wanting; Legendary Entertainment, run by a Hollywood outsider, gets a large piece of the blockbuster movie season; and the FX channel embraces the dark side of storytelling.
Business	https://mediadecoder.blogs.nytimes.com/2013/02/03/the-verge-hires-writer-who-quit-cnet-in-protest/	2013-02-03T20:02:38Z	Greg Sandoval said The Verge had given him a "written guarantee from management that nobody from the business side of the company will ever have any authority over my stories."
