section	web_url	pub_date	snippet
Business	https://query.nytimes.com/gst/fullpage.html?res=9D03E3D9173BF930A25756C0A9659D8B63	2013-05-13T00:00:00Z	In his 12 years as chief executive of  Exxon Mobil , Lee R. Raymond had a reputation for bulldozing analysts and long-winded shareholders and going toe-to-toe with government authorities. &#xa;   &#xa;Now as the lead director on the board of  JPMo...
Business	https://query.nytimes.com/gst/fullpage.html?res=990DEEDC1638F930A25756C0A9659D8B63	2013-05-13T00:00:00Z	Apple and Samsung Electronics are sucking up every penny of profit in the handset business. But Samsung&#x2019;s mobile business is growing fast, and the question is: Could it surpass Apple in profit next quarter?&#xa;   &#xa;Analysts at Canaccord...
Business	https://query.nytimes.com/gst/fullpage.html?res=9B07E3DB1438F932A25756C0A9659D8B63	2013-05-11T00:00:00Z	It may sound like a solution: You are mired in debt and a telemarketer calls, offering to help reduce the amount you owe, in exchange for a fee.&#xa;   &#xa;But consumers should be very wary of such calls, said Claire Rosenzweig, president and chi...
Business	https://query.nytimes.com/gst/fullpage.html?res=9C04E4DE1138F933A25756C0A9659D8B63	2013-05-10T00:00:00Z	California&#x2019;s top law enforcement official accused JPMorgan Chase on Thursday of flooding the state&#x2019;s courts with questionable lawsuits to collect overdue credit card debt.&#xa;   &#xa;The suit, filed in California Superior Court by t...
Business	https://query.nytimes.com/gst/fullpage.html?res=9C02E3DE1038F933A25756C0A9659D8B63	2013-05-10T00:00:00Z	12:24 a.m. | Updated &#xa;&#xa;   &#xa;When federal regulators sued the high-flying money manager Philip A. Falcone last summer, they claimed his actions &#x201C;read like the final exam in a graduate school course in how to operate a hedge fund u...
Business	https://query.nytimes.com/gst/fullpage.html?res=9903E6DB1138F933A25756C0A9659D8B63	2013-05-10T00:00:00Z	8:51 p.m. | Updated &#xa;&#xa;   &#xa;At the height of his powers, Steven A. Cohen, the owner of the hedge fund giant SAC Capital Advisors, turned away investors. These days, he is fighting to keep them.
Business	https://mediadecoder.blogs.nytimes.com/2013/05/09/fox-offers-an-early-glimpse-of-its-new-season/	2013-05-09T00:37:44Z	The Fox network announced four new dramas and five new comedies it has ordered for the next television season.
Business	https://query.nytimes.com/gst/fullpage.html?res=9507E1DA1238F93AA35756C0A9659D8B63	2013-05-09T00:00:00Z	8:27 p.m. | Updated &#xa;&#xa;   &#xa;Jeffrey K. Skilling, imprisoned for the last six years because of his role in the fraud that caused the collapse of Enron, has reached a deal that could reduce his sentence by more than a decade.
Business	https://query.nytimes.com/gst/fullpage.html?res=9D05E2D91238F93AA35756C0A9659D8B63	2013-05-09T00:00:00Z	8:58 p.m. | Updated At least these checks cleared.&#xa;   &#xa;Three weeks after checks sent to homeowners as compensation for foreclosure abuses were rejected for insufficient funds, the consulting firm at the center of the mishap erred again: a ...
Business	https://query.nytimes.com/gst/fullpage.html?res=9C06E6DE1338F93AA35756C0A9659D8B63	2013-05-09T00:00:00Z	Microsoft named Amy Hood, an executive at the company, as its chief financial officer, the first woman to hold the top finance job at Microsoft. &#xa;   &#xa;Ms. Hood, 41, joined Microsoft in late 2002 and was most recently the chief financial off...
Business	https://query.nytimes.com/gst/fullpage.html?res=9C0CE3DB1338F93AA35756C0A9659D8B63	2013-05-09T00:00:00Z	LAS VEGAS &#x2014; Just outside the grand ballroom at the Bellagio hotel early Wednesday morning, Anthony Scaramucci, the backslapping host of the country&#x2019;s largest hedge fund conference, spotted Gregory J. Fleming, president of Morgan Stan...
Business	https://query.nytimes.com/gst/fullpage.html?res=9F04E0DD1538F93BA35756C0A9659D8B63	2013-05-08T00:00:00Z	The fate of  Jamie Dimon  of  JPMorgan Chase  could hinge on a small, London-based firm that is virtually unknown, even on Wall Street.&#xa;   &#xa;The firm, Governance for Owners, has been tasked with voting the shares of the bank&#x2019;s larges...
Business	https://query.nytimes.com/gst/fullpage.html?res=9507E1DD1438F93BA35756C0A9659D8B63	2013-05-08T00:00:00Z	All deal makers have a number they want to hit. In the case of  Chrysler , the  United Automobile Workers  union has one number, and  Sergio Marchionne , the chief executive of both Chrysler and  Fiat , has another.&#xa;   &#xa;Alas, they are $6 b...
Business	https://query.nytimes.com/gst/fullpage.html?res=9B05E3DE1538F93BA35756C0A9659D8B63	2013-05-08T00:00:00Z	During the dot-com boom, Kleiner Perkins Caufield &#x26; Byers, the venture capital investment firm, all but minted money, making prescient early investments in Netscape Communications,  Amazon.com  and  Google  and delivering astonishing returns ...
Business	https://query.nytimes.com/gst/fullpage.html?res=9B06E1DD1438F93BA35756C0A9659D8B63	2013-05-08T00:00:00Z	New York&#x2019;s top banking regulator has begun an investigation into pension advance firms, the lenders that woo retirees to sign over their monthly pension checks in return for cash.&#xa;   &#xa;The regulator, the Department of Financial Servi...
Business	https://query.nytimes.com/gst/fullpage.html?res=9D05E2DF1638F934A35756C0A9659D8B63	2013-05-07T00:00:00Z	HONG KONG &#x2014; After a lackluster 2012 and slow start this year, Hong Kong&#x2019;s financiers are hoping to revive interest in initial public offerings. To test investor appetite, many companies are hiring armies of investment bankers in thei...
Business	https://query.nytimes.com/gst/fullpage.html?res=9C05E4D91F39F934A35756C0A9659D8B63	2013-05-07T00:00:00Z	8:04 p.m. | Updated &#xa;&#xa;   &#xa;New York&#x2019;s top prosecutor plans to sue two mortgage titans,  Bank of America  and  Wells Fargo , over claims that they breached the terms of a multibillion-dollar settlement intended to end foreclosure ...
Business	https://query.nytimes.com/gst/fullpage.html?res=9506E1DF1738F934A35756C0A9659D8B63	2013-05-07T00:00:00Z	OMAHA &#x2014; A little under an hour into the question-and-answer session at  Berkshire Hathaway &#x2019;s annual meeting here on Saturday, a name searing with history but now largely forgotten was mentioned: Henry E. Singleton.&#xa;   &#xa;Mr. S...
Business	https://query.nytimes.com/gst/fullpage.html?res=9C03E6D91638F934A35756C0A9659D8B63	2013-05-07T00:00:00Z	A Los Angeles-area jeweler has been formally charged with making illegal stock trades based on secret information obtained from a former senior partner at the accounting giant KPMG. &#xa;   &#xa;Prosecutors unveiled charges in Federal District Cou...
Business	https://query.nytimes.com/gst/fullpage.html?res=9502E6DC1638F934A35756C0A9659D8B63	2013-05-07T00:00:00Z	8:29 p.m. | Updated &#xa;&#xa;   &#xa; Bank of America  and MBIA, the troubled bond insurer, have reached a $1.7 billion agreement to settle a long-running legal dispute over mortgage-backed securities that became troubled when the financial crisi...
Business	https://query.nytimes.com/gst/fullpage.html?res=9404E3DB1638F934A35756C0A9659D8B63	2013-05-07T00:00:00Z	8:22 p.m. | Updated  It&#x2019;s not often that a popular television show illustrates corporate finance. But the most recent episode of &#x201C;Mad Men&#x201D; provided a lesson in advertising agency deal-making, circa 1968.&#xa;   &#xa;But before...
Business	https://query.nytimes.com/gst/fullpage.html?res=9500E1DC1E30F935A35756C0A9659D8B63	2013-05-06T00:00:00Z	You can tell when a technology is really taking hold. In addition to picking up customers, it generates other businesses that require their own care and feeding. And some of those businesses can illustrate how much more business is out there.&#xa;...
Business	https://query.nytimes.com/gst/fullpage.html?res=9F02E4D91739F935A35756C0A9659D8B63	2013-05-06T00:00:00Z	Online education is a sprawling category that encompasses everything from   open online courses  on physics, history and other college subjects to  intensive, multiday workshops  on photography on sites like CreativeLive.&#xa;   &#xa;Then there&#x...
Business	https://query.nytimes.com/gst/fullpage.html?res=9C00E3DF1F39F935A35756C0A9659D8B63	2013-05-06T00:00:00Z	8:28 p.m. | Updated A group of  private equity  firms led by Bain Capital and Golden Gate Capital is near a deal to buy  BMC Software , people briefed on the matter said on Sunday, nearly a year after an activist hedge fund sought to push the tech...
Business	https://query.nytimes.com/gst/fullpage.html?res=9503EFD61E39F935A35756C0A9659D8B63	2013-05-06T00:00:00Z	An influential shareholder advisory firm has recommended that investors withhold their support for three JPMorgan Chase directors, citing &#x201C;material failures of stewardship and risk oversight&#x201D; in the wake of a big trading loss last ye...
Business	https://query.nytimes.com/gst/fullpage.html?res=9C00E4D71739F935A35756C0A9659D8B63	2013-05-06T00:00:00Z	Marissa Mayer is trying to repair Yahoo&#x2019;s image by upgrading benefits for working parents. &#xa;   &#xa;On Tuesday, Yahoo announced a revised paid leave policy for new parents, more than doubling the time, in some cases, that employees with...
Business	https://query.nytimes.com/gst/fullpage.html?res=9902E6D71130F937A35756C0A9659D8B63	2013-05-04T00:00:00Z	Carl Richards is a certified financial planner in Park City, Utah, and is the director of investor education at The BAM Alliance. His book, &#x201C; The Behavior Gap, &#x201D; was published this year. His sketches are archived&#xA0; on the Bucks b...
Business	https://query.nytimes.com/gst/fullpage.html?res=9C04E6D61539F937A35756C0A9659D8B63	2013-05-04T00:00:00Z	An analysis from the  Pew Charitable Trusts  finds that the use of the mortgage interest deduction varies widely across the country, with concentrations on the East Coast and in the West, and in areas with higher property values. The average size ...
Business	https://query.nytimes.com/gst/fullpage.html?res=9E00E4DA1339F937A35756C0A9659D8B63	2013-05-04T00:00:00Z	6:03 a.m. | Updated &#xa;&#xa;   &#xa;LONDON &#x2014; The Royal Bank of Scotland signaled that it was moving closer to privatization on Friday as the bank reported its first quarterly profit since 2011.
Business	https://query.nytimes.com/gst/fullpage.html?res=9B01E6D71739F937A35756C0A9659D8B63	2013-05-04T00:00:00Z	The April 15 tax deadline is now receding in our collective rear view mirror. Nothing to do now, but to start collecting records for next year. Right?&#xa;   &#xa;Unless, of course, you are audited by the Internal Revenue Service.
Business	https://query.nytimes.com/gst/fullpage.html?res=9E05E1DB1039F937A35756C0A9659D8B63	2013-05-04T00:00:00Z	Mario J. Gabelli is more likely to be listed among the United States&#x2019; best-known money managers than among its highest paid chief executives. But that is not because he does not qualify for both lists. He does.&#xa;   &#xa;Mr. Gabelli belon...
Business	https://query.nytimes.com/gst/fullpage.html?res=9907E5D71039F937A35756C0A9659D8B63	2013-05-04T00:00:00Z	When Eastman Kodak emerges from bankruptcy this summer or fall, it will be a shadow of the blue-chip corporate giant it once was.&#xa;   &#xa;A celebrated company whose little yellow packages of film documented generations of birthday parties, wed...
Business	https://query.nytimes.com/gst/fullpage.html?res=9B02E6DC1039F937A35756C0A9659D8B63	2013-05-04T00:00:00Z	A nagging sense seems to pervade the public&#x2019;s mind that the nation&#x2019;s biggest banks still pose a risk to the wider economy, despite all that has been done since the 2008 financial crisis. &#xa;   &#xa;It seems that disquiet persists e...
Business	https://query.nytimes.com/gst/fullpage.html?res=9803E1DD1139F937A35756C0A9659D8B63	2013-05-04T00:00:00Z	As  JPMorgan Chase &#x2019;s annual meeting nears, much of the tension surrounds a critical vote to split the chairman and chief executive roles &#x2014; a decision that could strip  Jamie Dimon , the bank&#x2019;s influential leader, of the dual ...
Business	https://query.nytimes.com/gst/fullpage.html?res=980CE6DA1439F930A35756C0A9659D8B63	2013-05-03T00:00:00Z	More than a year after  Ted Genoways resigned  as the editor of the Virginia Quarterly Review, the literary journal has named a successor.&#xa;   &#xa;The new editor, W. Ralph Eubanks, is currently the director of publishing at the Library of Cong...
Business	https://query.nytimes.com/gst/fullpage.html?res=9E00E4DB1E39F930A35756C0A9659D8B63	2013-05-03T00:00:00Z	It is a scene that has played out over and over at the federal courthouse in Lower Manhattan.&#xa;   &#xa;A once high-flying hedge fund trader stands before a judge, often apologizing for his misdeeds. A high-priced defense lawyer asks for lenienc...
Business	https://query.nytimes.com/gst/fullpage.html?res=950DE4D81539F930A35756C0A9659D8B63	2013-05-03T00:00:00Z	7:54 p.m. | Updated &#xa;&#xa;   &#xa;Steven A. Cohen, the founder of the hedge fund SAC Capital Advisors, sat for a deposition in a lawsuit in 2011 and acknowledged that he was unfamiliar with his firm&#x2019;s compliance and ethics policies on i...
Business	https://query.nytimes.com/gst/fullpage.html?res=940DE4DD1339F930A35756C0A9659D8B63	2013-05-03T00:00:00Z	In most years,  Berkshire Hathaway &#x2019;s annual meeting is a weekend-long ode to capitalism and generally a lovefest for   Warren E. Buffett .&#xa;   &#xa;But on Saturday, a hedge fund manager handpicked by the billionaire himself will try to ...
Business	https://query.nytimes.com/gst/fullpage.html?res=9A0DE6DE1539F931A35756C0A9659D8B63	2013-05-02T00:00:00Z	President Obama&#x2019;s overhaul of the mortgage market has been a long time coming.&#xa;   &#xa;But he took a significant step forward on Wednesday, announcing his intention to nominate a new director for an agency that plays a crucial role in t...
Business	https://query.nytimes.com/gst/fullpage.html?res=950DE7D61739F931A35756C0A9659D8B63	2013-05-02T00:00:00Z	The biggest banks have done an excellent job of delaying and undermining the Dodd-Frank financial overhaul law and staving off criminal investigations into wrongdoing.&#xa;   &#xa;Maybe, just maybe, they&#x2019;ve been too successful.
Business	https://query.nytimes.com/gst/fullpage.html?res=9A04E0D71739F931A35756C0A9659D8B63	2013-05-02T00:00:00Z	LONDON &#x2014; As Big Oil increasingly becomes Big Gas, no major petroleum player may have more at stake in the shift than  Royal Dutch Shell .&#xa;   &#xa;More than any of its rivals, Royal Dutch Shell, which will report its quarterly results on...
Business	https://query.nytimes.com/gst/fullpage.html?res=9B07E2D81130F931A35756C0A9659D8B63	2013-05-02T00:00:00Z	When the advocates at  Family Forward Oregon  sought to muster support among businesses in Portland for a local paid sick leave ordinance, they found a sympathetic ear in Tony Fuentes. Mr. Fuentes and his wife operate  Milagros Boutique , which se...
Business	https://query.nytimes.com/gst/fullpage.html?res=9A07E4DA1739F931A35756C0A9659D8B63	2013-05-02T00:00:00Z	I recently had a conversation with someone who is starting a social enterprise to connect corporate sponsors with the social networks of activists, athletes, musicians and others. He was asking me for advice on  learning to code  so that he could ...
Business	https://query.nytimes.com/gst/fullpage.html?res=980CE3DF1439F931A35756C0A9659D8B63	2013-05-02T00:00:00Z	Last week,  we published a case study  about an entrepreneur, new to the furniture business, who had expanded his business selling patio and deck furniture to $7 million in annual sales. Instead of selling through sales representatives, Gerald Shv...
Business	https://query.nytimes.com/gst/fullpage.html?res=9D0CE5DE1539F931A35756C0A9659D8B63	2013-05-02T00:00:00Z	To attract financial advisers, brokerage firms often offer them loans. They are loans with a difference, however.&#xa;   &#xa;The loans are essentially payments to lure the advisers &#x2014; and presumably many of their clients &#x2014; to the fir...
Business	https://query.nytimes.com/gst/fullpage.html?res=9E0DE0DB1F30F931A35756C0A9659D8B63	2013-05-02T00:00:00Z	A couple of weeks ago, I took to Twitter with the following imperative: &#x201C;If you haven&#x2019;t seen the film Undefeated, you should asap. @IamCoachBill is a real #leader who draws out the true #character of his players.&#x201D;&#xa;   &#xa;...
Business	https://query.nytimes.com/gst/fullpage.html?res=9F02E2DC1639F932A35756C0A9659D8B63	2013-05-01T00:00:00Z	9:00 p.m. | Updated &#xa;&#xa;   &#xa;With a $145 billion cash hoard,  Apple  could acquire  Facebook ,  Hewlett-Packard  and  Yahoo . Put another way, it could buy every office building and retail space in New York, according to city estimates.
Business	https://query.nytimes.com/gst/fullpage.html?res=9C02E5D91639F932A35756C0A9659D8B63	2013-05-01T00:00:00Z	It&#x2019;s the dream of entrepreneurs to sell their company for millions of dollars. But the dirty secret of venture capital is that the dream can be dashed as the venture capitalists make millions in a sale, leaving the founders with nothing.&#x...
Business	https://query.nytimes.com/gst/fullpage.html?res=940DE6D81F30F932A35756C0A9659D8B63	2013-05-01T00:00:00Z	4:55 p.m. | Updated &#xa;&#xa;   &#xa;Despite persistent unemployment, malaise and continuing debt problems, one sector in Europe seems to be benefiting: European banks.
Business	https://query.nytimes.com/gst/fullpage.html?res=9F04EEDC1639F932A35756C0A9659D8B63	2013-05-01T00:00:00Z	8:56 p.m. | Updated The outspoken chief executive of  SoftBank  went on the offensive on Tuesday, arguing that his $20 billion offer for  Sprint Nextel  would prevail unmodified over a bold competing bid made by  Charles W. Ergen &#x2019;s Dish Ne...
Business	https://query.nytimes.com/gst/fullpage.html?res=9805EED91F30F932A35756C0A9659D8B63	2013-05-01T00:00:00Z	4:58 p.m. | Updated FRANKFURT &#x2014; Shares in Deutsche Bank rose for a second day after the bank sold 2.96 billion euros ($3.87 billion) in new stock on Tuesday to help it bolster the size of its capital reserves.&#xa;   &#xa;Deutsche Bank has ...
Business	https://query.nytimes.com/gst/fullpage.html?res=9C04E6DB1130F933A05757C0A9659D8B63	2013-04-30T00:00:00Z	8:29 p.m. | Updated &#xa;&#xa;   &#xa;Alfredo S&#xE1;enz resigned on Monday as chief executive of Banco Santander, Spain&#x2019;s largest bank, in a move that ends a period of uncertainty over the bank&#x2019;s leadership. Mr. S&#xE1;enz had been ...
Business	https://query.nytimes.com/gst/fullpage.html?res=9F0CE3D71130F933A05757C0A9659D8B63	2013-04-30T00:00:00Z	Kodak said on Monday that it would spin off its document and personal imaging units to its British pension plan for $650 million in cash and noncash considerations, a move that paves the way for Kodak&#x2019;s exit from bankruptcy protection.&#xa;...
Business	https://query.nytimes.com/gst/fullpage.html?res=9804E5DE1E30F933A05757C0A9659D8B63	2013-04-30T00:00:00Z	8:17 p.m. | Updated &#xa;&#xa;   &#xa;FRANKFURT &#x2014;  Deutsche Bank , Germany&#x2019;s largest bank, moved Monday to address criticism that it has too thin a cushion against risk, announcing that it planned to issue $3.65 billion in new stock ...
Business	https://query.nytimes.com/gst/fullpage.html?res=9F05E2DE1F30F933A05757C0A9659D8B63	2013-04-30T00:00:00Z	In the depths of the financial crisis,  Jamie Dimon , the chief executive of  JPMorgan , and his top lieutenants were hailed as &#x201C;The Survivors&#x201D; on a  Fortune magazine cover . Today, of the 15 executives featured in that article, only...
Business	https://query.nytimes.com/gst/fullpage.html?res=9C04E5D91130F933A05757C0A9659D8B63	2013-04-30T00:00:00Z	5:32 p.m. | Updated &#xa;&#xa;   &#xa;The Internet giant  Alibaba  was once known as China&#x2019;s answer to  eBay . Now it is forging closer ties to the country&#x2019;s counterpart to  Twitter .
Business	https://query.nytimes.com/gst/fullpage.html?res=990CE3D91030F93AA15757C0A9659D8B63	2013-04-29T00:00:00Z	Old television shows continue to generate revenue long after they have been canceled. Proof abounds on TV Land, a Viacom channel, where almost 700,000 viewers sought out each of the 2013 &#x201C;Bonanza&#x201D; broadcasts. The western ran from 195...
Business	https://query.nytimes.com/gst/fullpage.html?res=9C00E2D91030F93AA15757C0A9659D8B63	2013-04-29T00:00:00Z	In the days after the  Boston Marathon  bombings, the social media and  entertainment site Reddit  had the breakout moment it had been waiting for &#x2014; but not the one it expected.&#xa;   &#xa;After site members, known as Redditors, turned int...
Business	https://query.nytimes.com/gst/fullpage.html?res=9C05E1DA1030F93AA15757C0A9659D8B63	2013-04-29T00:00:00Z	A senior executive in the inner circle of  Jamie Dimon ,  JPMorgan Chase &#x2019;s chief executive, is leaving, the latest departure after the bank reported a multibillion-dollar trading loss last year. &#xa;   &#xa;Frank J. Bisignano, co-chief op...
Business	https://query.nytimes.com/gst/fullpage.html?res=9506E7DA1430F93AA15757C0A9659D8B63	2013-04-29T00:00:00Z	Security researchers recently shed a bright light on the  multimillion-dollar underground market for fake Twitter followers . Now, they are highlighting what they believe to be some of the market&#x2019;s high-profile clientele.&#xa;   &#xa;In a f...
Business	https://query.nytimes.com/gst/fullpage.html?res=9D00E6DC1030F93BA15757C0A9659D8B63	2013-04-28T00:00:00Z	&#x201C;This is predatory lending, plain and simple.&#x201D;&#xa;&#xa;   &#xa;Annette Smith, 69, a retiree in Rocklin, Calif., who says she has been ensnared by the short-term, high-cost credit known as the payday loan since she borrowed $500 more...
Business	https://query.nytimes.com/gst/fullpage.html?res=9A07EEDC1E30F93BA15757C0A9659D8B63	2013-04-28T00:00:00Z	As the Clock Is Ticking &#xa;&#xa;   &#xa; &#x201C;Need Motivation? Declare a Deadline,&#x201D;  the Workstation column last Sunday, described the human tendency to procrastinate &#x2014; as well as an often-dependable way to conquer it.
Business	https://query.nytimes.com/gst/fullpage.html?res=9D07E5D61230F934A15757C0A9659D8B63	2013-04-27T00:00:00Z	LivingSocial, the daily deals site, told its employees Friday that it had been breached, and said that data for 50 million users might have been compromised.&#xa;   &#xa;In a memo to employees, the company, based in Washington, said online crimina...
Business	https://query.nytimes.com/gst/fullpage.html?res=9904E6DB1331F934A15757C0A9659D8B63	2013-04-27T00:00:00Z	Recently, I got something in the mail that I haven&#x2019;t seen in awhile: an offer of a credit card with a zero percent introductory rate that stretched for 18 months &#x2014; for both new purchases and balance transfers.&#xa;   &#xa;Apparently,...
Business	https://query.nytimes.com/gst/fullpage.html?res=9F03EED81331F934A15757C0A9659D8B63	2013-04-27T00:00:00Z	This past Saturday, I wrote my  Shortcuts column  on why people don&#x2019;t respond to e-mails. And boy, did I get a lot of responses. Clearly many readers out there are fuming over their in-boxes.&#xa;   &#xa;One reader, Marc Allan of Indianapol...
Business	https://query.nytimes.com/gst/fullpage.html?res=9F03EEDA1730F934A15757C0A9659D8B63	2013-04-27T00:00:00Z	Here is my deep, dark secret from high school: I didn&#x2019;t go to the prom.&#xa;   &#xa;It&#x2019;s a long story, filled with teenage angst. But suffice it to say, I missed an American rite of passage &#x2014; and I survived.
Business	https://mediadecoder.blogs.nytimes.com/2013/04/26/see-all-media-news-in-one-place/	2013-04-26T11:31:00Z	The New York Times’ Media news can now be found at the Media & Advertising section front.
Business	https://query.nytimes.com/gst/fullpage.html?res=9F02EFDB1430F935A15757C0A9659D8B63	2013-04-26T00:00:00Z	J. C. Penney  doesn&#x2019;t have many fans on Wall Street. But a big one emerged on Thursday:  George Soros .&#xa;   &#xa;Mr. Soros, the hedge fund billionaire, on Thursday disclosed a 7.9 percent stake in Penney, with 17.4 million shares, accord...
Business	https://query.nytimes.com/gst/fullpage.html?res=940CE5DB1030F935A15757C0A9659D8B63	2013-04-26T00:00:00Z	9:24 p.m. | Updated &#xa;&#xa;   &#xa;Trading on the nation&#x2019;s largest options exchange was delayed for several hours on Thursday because of computer problems, the latest incident to highlight the vulnerability of markets to technological sh...
Business	https://query.nytimes.com/gst/fullpage.html?res=9405E1DE1530F935A15757C0A9659D8B63	2013-04-26T00:00:00Z	Zynga &#x2019;s latest quarterly earnings report, released on Wednesday, came in the typical format and was accompanied with the usual financial tables investors expect.&#xa;   &#xa;But the social gaming company that counts FarmVille among its gam...
Business	https://query.nytimes.com/gst/fullpage.html?res=9C07E0D71430F935A15757C0A9659D8B63	2013-04-26T00:00:00Z	8:35 p.m. | Updated &#xa;&#xa;   &#xa;To pursue its civil fraud case against the  American International Group &#x2019;s former chief executive,  Maurice R. Greenberg , the New York attorney general&#x2019;s office is taking an unusual step.
Business	https://query.nytimes.com/gst/fullpage.html?res=9C0DE3DB1130F935A15757C0A9659D8B63	2013-04-26T00:00:00Z	As an accomplished mountaineer who has scaled many of the world&#x2019;s highest peaks, including Mount Everest, Annabelle Bond has found herself in some dicey situations.&#xa;   &#xa;Now she finds herself in a very different sort of predicament &...
Business	https://query.nytimes.com/gst/fullpage.html?res=9C06E3D81430F935A15757C0A9659D8B63	2013-04-26T00:00:00Z	U.S. URGES CURBS ON PAYDAY LOANS Federal regulators on Thursday urged some of the nation&#x2019;s largest banks to put restrictions on payday-style loans tied to customers&#x2019; checking accounts. The guidance from the Office of the Comptroller ...
