section	web_url	pub_date	snippet
Business	https://mediadecoder.blogs.nytimes.com/2012/10/22/showtime-orders-third-season-of-homeland/	2012-10-22T15:12:08Z	"Homeland" is not the most-watched show on Showtime, but in winning Emmy Awards for best drama, best actress and best actor, the network has never had a show with so much prestige value.
Business	https://mediadecoder.blogs.nytimes.com/2012/10/22/just-a-minute-3-screens-for-3-televised-matchups/	2012-10-22T14:04:25Z	Brian Stelter has a solution for TV viewers who think they must choose among watching the debate, the baseball playoff game and "Monday Night Football."
Business	https://mediadecoder.blogs.nytimes.com/2012/10/22/breakfast-meeting-the-poetry-of-print/	2012-10-22T09:51:14Z	Also, the Walt Disney Company is searching for online magic with its third Web site makeover in five years.
Business	https://mediadecoder.blogs.nytimes.com/2012/10/21/hearst-plans-holiday-e-book-of-its-magazines-recipes/	2012-10-21T21:24:03Z	"Let's Talk Turkey," an e-book on sale Tuesday, will feature recipes from Woman's Day, Good Housekeeping, Redbook and other Hearst magazines.
Business	https://mediadecoder.blogs.nytimes.com/2012/10/21/espn-suggests-watching-monday-night-game-and-debate-on-2-screens/	2012-10-21T20:29:44Z	A pair of ads on ESPN encourage fans to watch "Monday Night Football" along with the final presidential debate, one on a TV set and the other on a laptop or tablet computer.
Business	https://mediadecoder.blogs.nytimes.com/2012/10/21/leo-burnett-to-present-a-play-based-on-new-yorkers-stories/	2012-10-21T20:24:53Z	Using material gathered on a Web site, the advertising agency worked with The Village Voice to create "8 Million Protagonists."
Business	https://mediadecoder.blogs.nytimes.com/2012/10/21/amc-and-dish-reach-deal-for-return-of-channels/	2012-10-21T18:43:57Z	AMC Networks' flagship channel, AMC, came back to Dish on Sunday in time for the second episode of the new season of "The Walking Dead."
Business	https://mediadecoder.blogs.nytimes.com/2012/10/19/roger-ailes-is-said-to-sign-up-for-another-4-years-at-fox/	2012-10-19T14:19:32Z	Mr. Ailes will remain in charge of the Fox News Channel, the News Corporation said on Friday, ending a protracted period of speculation about his contract negotiations.
Business	https://mediadecoder.blogs.nytimes.com/2012/10/19/for-clinton-and-marie-claire-much-ado-about-whining/	2012-10-19T13:59:42Z	Comments by the secretary of state about her dislike of whining were interpreted, incorrectly, as referring to her former top policy adviser, Anne-Marie Slaughter.
Business	https://mediadecoder.blogs.nytimes.com/2012/10/19/media-agency-leaders-respond-to-newsweek-decision/	2012-10-19T09:00:51Z	The magazine's decision to proceed as an online-only publication has gotten the attention of Madison Avenue, which has spent hundreds of millions of dollars through the decades to buy advertising pages in the magazine.
Business	https://mediadecoder.blogs.nytimes.com/2012/10/19/breakfast-meeting-bowing-to-pressure-newsweek-will-end-print-edition/	2012-10-19T08:15:25Z	Newsweek announced it would cease print publication at the end of the year and move to an all-digital format, and a former Goldman Sachs trader offers few details in his new tell-all.
Business	https://mediadecoder.blogs.nytimes.com/2012/10/18/paul-fichtenbaum-named-as-time-inc-sports-group-editor/	2012-10-18T23:14:43Z	Mr. Fichtenbaum, who for eight years ran Sports Illustrated's Web site, replaces Terry McDonell.
Business	https://mediadecoder.blogs.nytimes.com/2012/10/18/hollywood-still-awaits-coroners-report-on-tony-scotts-death/	2012-10-18T19:21:51Z	Mr. Scott plunged from a bridge in Los Angeles on Aug. 19, but results of the autopsy have not yet been released.
Business	https://mediadecoder.blogs.nytimes.com/2012/10/18/start-nears-on-plan-to-combat-online-infringement/	2012-10-18T17:13:58Z	More than a year after it was announced, a program to fight infringement through an escalating series of alerts to suspected violators is moving forward, said the Center for Copyright Information, the group charged with carrying it out.
Business	https://mediadecoder.blogs.nytimes.com/2012/10/18/nbc-pulls-the-plug-on-animal-practice/	2012-10-18T16:34:41Z	The new sitcom will be replaced in the Wednesday lineup with the second-year sitcom "Whitney."
Business	https://mediadecoder.blogs.nytimes.com/2012/10/18/newsweek-will-cease-print-publication-at-end-of-year/	2012-10-18T08:12:06Z	The struggling weekly magazine will publish its final print edition on Dec. 31 and move into an all-digital format next year, announced its editor, Tina Brown.
Business	https://mediadecoder.blogs.nytimes.com/2012/10/17/warner-brothers-wins-legal-case-over-rights-to-superman/	2012-10-17T21:25:01Z	The ruling means that the studio and DC Comics can move forward for more plans for Superman movies and products.
Business	https://mediadecoder.blogs.nytimes.com/2012/10/17/2nd-debate-also-a-ratings-hit-drawing-65-6-million-at-home-viewers/	2012-10-17T17:54:27Z	The big cable winner was Fox News, with the biggest audience in the channel's history.
Business	https://mediadecoder.blogs.nytimes.com/2012/10/17/in-debate-crowley-found-herself-part-of-the-fray/	2012-10-17T17:08:22Z	Candy Crowley, who moderated Tuesday night's presidential debate, had to try to guide two candidates who seemed bent on trampling the rules.
Business	https://mediadecoder.blogs.nytimes.com/2012/10/17/michael-savage-signs-deal-with-cumulus-media/	2012-10-17T16:53:19Z	The popular conservative radio host has found a new home for his show, "The Savage Nation," which went off the air last month after he won a legal battle to leave his former employer.
Business	https://mediadecoder.blogs.nytimes.com/2012/10/17/kcet-joins-link-tv-in-new-venture/	2012-10-17T12:15:17Z	The two California-based public television businesses will join forces in a new venture known as KCETLink.
Business	https://mediadecoder.blogs.nytimes.com/2012/10/17/breakfast-meeting-a-moderators-lot-is-not-a-happy-one/	2012-10-17T09:17:14Z	Also, Hilary Mantel captures her second Man Booker Prize in four years for the novel "Bring Up the Bodies."
Business	https://mediadecoder.blogs.nytimes.com/2012/10/16/with-an-eye-to-digital-music-publishing-agency-appoints-a-new-chief/	2012-10-16T18:12:07Z	The Harry Fox Agency has promoted Michael S. Simon, its senior vice president for business affairs, to chief executive, replacing Gary L. Churgin, who is leaving the organization.
Business	https://mediadecoder.blogs.nytimes.com/2012/10/16/murdoch-prevails-over-protests-at-news-corp-annual-meeting/	2012-10-16T16:25:41Z	The company also elected two new board members: Elaine Chao, who worked in the Bush White House, and Álvaro Uribe, the former president of Colombia.
Business	https://mediadecoder.blogs.nytimes.com/2012/10/16/hollywood-moguls-pledge-90-million-to-organization-supporting-workers/	2012-10-16T14:58:40Z	David Geffen, Jeffrey Katzenberg and Steven Spielberg each pledged $30 million to the non-profit Motion Picture & Television Fund, which provides health services and other support.
Business	https://mediadecoder.blogs.nytimes.com/2012/10/16/ted-turner-cited-for-place-based-media-efforts/	2012-10-16T14:47:12Z	Mr. Turner, who was honored on Tuesday morning by the Digital Place-Based Advertising Association, was given the first award presented by the group to someone its members deem an industry visionary.
Business	https://mediadecoder.blogs.nytimes.com/2012/10/16/cnn-to-interview-reddits-violentacrez-a-troll-comes-out-from-under-the-bridge/	2012-10-16T14:12:55Z	Violentacrez, the moderator of several highly controversial forums on Reddit, was outed on Gawker and fired from his job, and he will now sit for an interview with CNN.
Business	https://mediadecoder.blogs.nytimes.com/2012/10/16/news-corporation-shareholders-meeting-much-ado-might-not-add-up-to-much/	2012-10-16T09:27:32Z	Despite new revelations in the hacking scandal and significant protests from large shareholders expected at Tuesday's annual meeting, the Murdochs' control of News Corporation will very likely continue.
Business	https://mediadecoder.blogs.nytimes.com/2012/10/16/breakfast-meeting-the-rules-of-debate-engagement/	2012-10-16T09:15:49Z	Also, life after Ricky Gervais at the Golden Globe Awards will feature Amy Poehler and Tina Fey.
Business	https://mediadecoder.blogs.nytimes.com/2012/10/15/moonves-signs-contract-extension-at-cbs/	2012-10-15T20:28:15Z	The new contract, keeping him as chief executive through 2017, supersedes a previous deal that was to expire in 2015.
Business	https://mediadecoder.blogs.nytimes.com/2012/10/15/adele-leads-record-label-to-67-million-profit/	2012-10-15T17:00:23Z	The singer's album, "21" - 2011's top seller around the world, with more than 18 million in sales - was a rainmaker for her label, XL.
Business	https://mediadecoder.blogs.nytimes.com/2012/10/15/walking-dead-sets-new-ratings-record-on-amc/	2012-10-15T16:37:47Z	The hugely popular drama became the biggest hit of the fall television season on Sunday night, with the premiere of its third season posting ratings that placed it at the top of all dramas in the history of basic cable television.
Business	https://mediadecoder.blogs.nytimes.com/2012/10/15/times-to-add-portuguese-language-edition/	2012-10-15T09:41:59Z	The new Web site, intended to reach readers in Brazil, will publish 30 to 40 articles a day with content on subjects like business, culture and global affairs.
Business	https://mediadecoder.blogs.nytimes.com/2012/10/15/breakfast-meeting-the-power-of-tv-debates/	2012-10-15T08:05:31Z	Also, a guide to how the campaigns will try to shape perceptions after Tuesday's debate, and concern about the moderator, Candy Crowley of CNN.
Business	https://mediadecoder.blogs.nytimes.com/2012/10/14/china-in-hollywood-hailed-and-investigated/	2012-10-14T16:02:55Z	A banquet honoring the gatekeeper of Chinese film, Han Sanping, comes against the backdrop of a corruption investigation of Hollywood's practices with companies in China.
Business	https://mediadecoder.blogs.nytimes.com/2012/10/12/vice-presidential-debate-draws-more-than-50-million-viewers/	2012-10-12T17:55:54Z	The number was considerably down from the Biden-Palin debate in 2008 but larger than any other since 1984.
Business	https://mediadecoder.blogs.nytimes.com/2012/10/12/talk-at-ad-conference-turns-to-risk-failure-and-mistakes/	2012-10-12T16:51:59Z	Advertising ought to be more of a risky business, according to some of the speakers at the 2012 annual conference of the Association of National Advertisers.
Business	https://mediadecoder.blogs.nytimes.com/2012/10/12/obama-to-appear-as-guest-on-the-daily-show-on-oct-18/	2012-10-12T16:48:31Z	The president is likely to face a series of comic barbs about his first debate performance, which has become prime fodder for late-night hosts.
Business	https://mediadecoder.blogs.nytimes.com/2012/10/12/erica-hill-moving-to-nbc-for-weekend-edition-of-today/	2012-10-12T11:44:45Z	Ms. Hill, removed from a CBS morning show this past summer, will co-host the weekend "Today'' show.
Business	https://mediadecoder.blogs.nytimes.com/2012/10/12/the-breakfast-meeting-raddatz-draws-a-partisan-split-and-what-republicans-and-democrats-watch/	2012-10-12T11:30:47Z	Also, how attacks on PBS turned into the Big Birdification of the campaign.
Business	https://mediadecoder.blogs.nytimes.com/2012/10/11/republicans-like-golf-democrats-prefer-cartoons-tv-research-suggests/	2012-10-11T19:42:52Z	A study by TiVo finds that television viewing is every bit as polarized as Congress.
Business	https://mediadecoder.blogs.nytimes.com/2012/10/11/digital-ad-report-finds-big-growth-in-mobile/	2012-10-11T15:46:10Z	The Interactive Advertising Bureau reported that mobile revenue rose 95 percent to $1.2 billion in the first half of 2012, while revenues for rich media and classified advertising declined.
World	https://www.nytimes.com/aponline/2018/07/03/world/americas/ap-cn-nafta-talks.html	2018-07-03T21:12:06+0000	With Mexico's presidential election out of the way, Canada is renewing its push to speed up the NAFTA renegotiation this summer.
World	https://www.nytimes.com/aponline/2018/07/03/world/americas/ap-soc-wcup-colombia-england.html	2018-07-03T21:09:08+0000	In a World Cup of surprises, England provided the latest by finally winning a penalty shootout.
World	https://www.nytimes.com/2018/07/03/world/americas/brazil-tycoon-eike-batista-sentenced.html	2018-07-03T21:06:16+0000	The dramatic rise and fall of the tycoon, Eike Batista, mirrored the tumultuous boom-and-bust cycle that has rattled Brazil during the past decade.
World	https://www.nytimes.com/2018/07/03/world/asia/pakistan-lahore-floods.html	2018-07-03T21:05:45+0000	Much of the eastern city of Lahore, home to 6 million people, is submerged.
World	https://www.nytimes.com/reuters/2018/07/03/world/europe/03reuters-germany-politics-merkel-analysis.html	2018-07-03T20:18:55+0000	Angela Merkel's face-saving deal with her conservative allies in Bavaria shows how indispensable the chancellor is to her party - even if she is weakened.
World	https://www.nytimes.com/aponline/2018/07/03/world/europe/ap-eu-france-extreme-right-arrests.html	2018-07-03T20:18:32+0000	A French judicial official says a man suspected of leading an extreme-right group and an alleged group member have been freed from detention with judicial supervision.
World	https://www.nytimes.com/reuters/2018/07/03/world/americas/03reuters-cuba-aviation.html	2018-07-03T20:04:14+0000	In the busy summer travel period in Cuba, a long line of people wait for hours in the sweltering heat outside the Havana office of state-owned airline Cubana, many of them eager to visit families in the provinces.
World	https://www.nytimes.com/reuters/2018/07/03/world/europe/03reuters-europe-migrants-germany-spd.html	2018-07-03T20:04:12+0000	The three political parties in Chancellor Angela Merkel's governing coalition have made progress in talks about setting up migration transit centers on the border with Austria but there is no agreement yet, SPD leader Andrea Nahles said on Tuesday...
World	https://www.nytimes.com/reuters/2018/07/03/world/asia/03reuters-usa-crime-alqaeda.html	2018-07-03T20:04:06+0000	A Manhattan federal judge on Tuesday voided the November 2005 conviction of a Pakistani man for conspiring to help an al Qaeda operative enter the United States, saying new evidence cast doubt on the defendant's guilt.
World	https://www.nytimes.com/reuters/2018/07/03/world/europe/03reuters-britain-vogue-oprah.html	2018-07-03T20:04:03+0000	American television mogul Oprah Winfrey has reiterated she will not run for president, saying it would "kill" her, drawing a line over speculation about a potential 2020 bid. 
World	https://www.nytimes.com/reuters/2018/07/03/world/europe/03reuters-europe-migrants-iom.html	2018-07-03T20:01:09+0000	Planned new centers around the Mediterranean to handle migrants will be no silver bullet solution to the European Union's immigration challenge, says a U.N. agency of the idea it will be asked to implement.
World	https://www.nytimes.com/reuters/2018/07/03/world/americas/03reuters-mexico-politics-pompeo.html	2018-07-03T20:01:06+0000	U.S. Secretary of State Mike Pompeo will visit Mexico soon to meet with Andres Manuel Lopez Obrador, the Mexican president-elect said on Tuesday, adding that his transition team would work in lockstep with current negotiators on NAFTA talks. 
World	https://www.nytimes.com/reuters/2018/07/03/world/europe/03reuters-germany-politics-merkel.html	2018-07-03T20:00:59+0000	Angela Merkel's face-saving deal with her conservative allies in Bavaria shows how indispensable the chancellor is to her party - even if she is weakened.
World	https://www.nytimes.com/reuters/2018/07/03/world/africa/03reuters-kenya-drugs.html	2018-07-03T20:00:55+0000	Heroin use is increasing in Kenya's coastal communities as international traffickers use them as a transit point for drugs bound from Afghanistan to the West, creating health and social problems, a European Union-funded report said on Tuesday.  
World	https://www.nytimes.com/aponline/2018/07/03/world/americas/ap-lt-chile-thailand-trapped.html	2018-07-03T19:54:10+0000	A rescued Chilean miner has advice for a trapped Thai boys soccer team half a world away: Help each other and mentally prepare for rescue.
World	https://www.nytimes.com/2018/07/03/world/africa/woman-kills-giraffe.html	2018-07-03T19:19:03+0000	Photographs of an American woman with the giraffe she shot in South Africa last year have fueled an online debate about big-game trophy hunting.
World	https://www.nytimes.com/aponline/2018/07/03/world/europe/ap-eu-europe-migrant-ship.html	2018-07-03T19:18:03+0000	Izzeddin al-Ghalban's first attempt to reach Europe ended when the boat engine died. The Libyan coast guard thwarted his second. After a third try, the 23-year-old rested on the deck of a Spanish aid group's rescue ship as it headed toward Barcelo...
World	https://www.nytimes.com/aponline/2018/07/03/world/americas/ap-lt-mexico-president-elect-the-latest.html	2018-07-03T19:06:12+0000	The Latest on Mexico's President-elect Andres Manuel Lopez Obrador (all times local):
World	https://www.nytimes.com/2018/07/03/world/asia/new-zealand-australia-deportations.html	2018-07-03T19:00:06+0000	New Zealanders are now the largest group inside Australian immigration detention centers, straining one of the world’s closest bilateral relationships.
World	https://www.nytimes.com/aponline/2018/07/03/world/americas/ap-lt-colombia-us-ambassador-nominee.html	2018-07-03T19:00:01+0000	A Republican senator has been blocking President Donald Trump's choice to become the next ambassador to Colombia, citing concerns that one of the State Department's most senior career diplomats mishandled the aftermath of the deadly assault on the...
World	https://www.nytimes.com/aponline/2018/07/03/world/americas/ap-cb-puerto-rico-economic-crisis.html	2018-07-03T18:51:06+0000	Austerity measures are looming for Puerto Rico after local senators on Tuesday for the second time shot down a measure aimed at overcoming budget differences between the U.S. territory's government and a federal control board overseeing its financ...
World	https://www.nytimes.com/aponline/2018/07/03/world/europe/ap-eu-italy-libya-migrants.html	2018-07-03T18:48:05+0000	Italy is supplying Libya with 12 naval boats, as migrant deaths at sea mount in the waters near the North African nation.
World	https://www.nytimes.com/aponline/2018/07/03/world/middleeast/ap-un-united-nations-syria-chemical-weapons.html	2018-07-03T18:30:31+0000	Syria is still failing to answer questions about its chemical weapons program, years after becoming a party to the chemical weapons convention, members of the U.N. Security Council said Wednesday.
World	https://www.nytimes.com/aponline/2018/07/03/world/ap-us-guam-abortion.html	2018-07-03T18:24:02+0000	Guam no longer has physicians performing abortions following the recent retirement of a doctor.
World	https://www.nytimes.com/aponline/2018/07/03/world/africa/ap-af-ethiopia-robot-meets-leader.html	2018-07-03T18:12:05+0000	In one of the world's more unusual diplomatic encounters, Ethiopia's new prime minister has met with a humanoid robot.
World	https://www.nytimes.com/reuters/2018/07/03/world/europe/03reuters-usa-russia-trump-putin-preparations.html	2018-07-03T17:48:48+0000	Russian Foreign Minister Sergei Lavrov and U.S. Secretary of State Mike Pompeo discussed preparations on Tuesday for the summit in Helsinki between presidents Vladimir Putin and Donald Trump, the Russian Foreign Ministry said. 
World	https://www.nytimes.com/reuters/2018/07/03/world/europe/03reuters-bosnia-britain.html	2018-07-03T17:45:48+0000	Britain warned nationalist Bosnian Serb leader Milorad Dodik on Tuesday against "inventing fake threats" from Britain as part of his campaigning ahead of an October election, saying such rhetoric may damage relations with the United Kingdom.
World	https://www.nytimes.com/aponline/2018/07/03/world/americas/ap-lt-brazil-corruption.html	2018-07-03T17:45:01+0000	A Brazilian businessman famous for amassing and then losing a multi-billion-dollar fortune has been convicted of corruption and money laundering and sentenced to 30 years in prison.
World	https://www.nytimes.com/aponline/2018/07/03/world/europe/ap-thailand-cave-search-british-divers.html	2018-07-03T17:42:07+0000	When authorities in Thailand were assembling a group of rescuers to search for a soccer team lost in a flooded cave, one of their first calls went to a retired firefighter and an IT consultant in England.
World	https://www.nytimes.com/aponline/2018/07/03/world/americas/ap-lt-mexico-violence.html	2018-07-03T17:39:00+0000	Gunmen have killed the mayor of a town in western Mexico where three Italian men went missing in late January.
World	https://www.nytimes.com/reuters/2018/07/03/world/europe/03reuters-usa-utilities-heatwave.html	2018-07-03T17:37:05+0000	Utilities in the U.S. Northeast expect to have enough power to keep the lights on as homes and businesses crank up air conditioners to escape a heat wave, the region's power grid operators said on Tuesday.
World	https://www.nytimes.com/reuters/2018/07/03/world/americas/03reuters-usa-airforce-light-attack.html	2018-07-03T17:37:04+0000	The US Air Force canceled remaining flights that were a part of its Light Attack experiment after a recent fatal crash of an A-29, an Air Force official said on Tuesday.
World	https://www.nytimes.com/aponline/2018/07/03/world/europe/ap-eu-italy-political-funding.html	2018-07-03T17:36:11+0000	Italy's top court has upheld a prosecutor's request to seize over 48 million euros ($57 million) from a government coalition party's coffers.
World	https://www.nytimes.com/reuters/2018/07/03/world/europe/03reuters-germany-crime.html	2018-07-03T17:33:48+0000	An Iraqi man suspected of the rape and killing of a 14-year-old German girl is also under investigation for raping an 11-year-old German girl in a refugee shelter in the town of Wiesbaden, prosecutors said on Tuesday.
World	https://www.nytimes.com/reuters/2018/07/03/world/europe/03reuters-israel-russia-netanyahu.html	2018-07-03T17:30:58+0000	Israeli Prime Minister Benjamin Netanyahu will meet Russian President Vladimir Putin in Moscow next week, Netanyahu's office said in a brief statement on Tuesday. The meeting is set for Wednesday, July 11. 
World	https://www.nytimes.com/reuters/2018/07/03/world/americas/03reuters-brazil-corruption-batista.html	2018-07-03T17:30:54+0000	Eike Batista, the former mining and oil magnate who was once Brazil's richest man, was convicted and sentenced to 30 years in prison for bribing Rio de Janeiro state's disgraced ex-governor, according to a court document published on Tuesday.
World	https://www.nytimes.com/reuters/2018/07/03/world/africa/03reuters-congo-violence-un.html	2018-07-03T17:30:53+0000	Rebels and government troops in Congo have committed atrocities including mass rape, cannibalism and the dismemberment of civilians, according to testimony published on Tuesday by a team of U.N. human rights experts who said the world must pay hee...
World	https://www.nytimes.com/reuters/2018/07/03/world/europe/03reuters-eu-poland-court.html	2018-07-03T17:30:50+0000	Poland's Supreme Court chief Malgorzata Gersdorf plans to go to work as usual on Wednesday, a court spokesman said, after President Andrzej Duda announced the judge would retire as of July 4.
World	https://www.nytimes.com/reuters/2018/07/03/world/americas/03reuters-nigeria-kidnapping.html	2018-07-03T17:30:46+0000	Nigerian police said they have rescued the father of national soccer team captain John Obi Mikel after he was kidnapped for the second time in seven years.
World	https://www.nytimes.com/reuters/2018/07/03/world/03reuters-slovenia-politics.html	2018-07-03T17:30:45+0000	Slovenian President Borut Pahor will on Friday renew talks with parliamentary parties to find a candidate for prime minister who can win a majority after an initial effort proved unsuccessful.
World	https://www.nytimes.com/reuters/2018/07/03/world/asia/03reuters-usa-russia-pompeo.html	2018-07-03T17:27:55+0000	U.S. Secretary of State Mike Pompeo and Russian foreign Minister Sergei Lavrov, in a call on Tuesday, discussed the upcoming Trump-Putin meeting as well as Syria and North Korea, the U.S. State Department said in a statement. 
World	https://www.nytimes.com/reuters/2018/07/03/world/africa/03reuters-soccer-worldcup-refugee-soccer.html	2018-07-03T17:19:02+0000	Migrants from Africa and Asia staged their own version of the World Cup in Moscow on Tuesday, playing soccer matches in Red Square in an event held to highlight challenges faced by refugees in Russia.
World	https://www.nytimes.com/aponline/2018/07/03/world/africa/ap-af-sierra-leone-police.html	2018-07-03T17:18:02+0000	Amnesty International is calling on Sierra Leone's new government to end police crackdowns on peaceful protesters and improve human rights.
World	https://www.nytimes.com/aponline/2018/07/03/world/europe/ap-eu-albania-underwater-archaeology.html	2018-07-03T17:15:13+0000	Researchers are urging Albanian authorities to build a museum to display hundreds of Roman and Greek artifacts and ancient shipwrecks that are sitting under Albania's least explored coastline.
World	https://www.nytimes.com/aponline/2018/07/03/world/americas/ap-lt-mexico-elections-pri.html	2018-07-03T17:09:01+0000	The landslide victory by Andres Manuel Lopez Obrador in Mexico's presidential election brought an abrupt end to the monopoly on power enjoyed by the Institutional Revolutionary Party, a nearly century-long dominance that cultivated corruption alon...
World	https://www.nytimes.com/aponline/2018/07/03/world/europe/ap-eu-britain-sex-abuse-allegations.html	2018-07-03T16:54:03+0000	Prosecutors say a British man who alleged he was abused by a ring of politically powerful pedophiles has been charged with inventing the claims.
