section	web_url	pub_date	snippet
World	https://www.nytimes.com/reuters/2018/07/01/world/middleeast/01reuters-oil-opec-iran.html	2018-07-01T09:12:14+0000	Iran has asked fellow OPEC members to "refrain from any unilateral measures", warning that would undermine the unity of OPEC, following reports that Saudi Arabia has raised its oil production to a record high this month. 
World	https://www.nytimes.com/aponline/2018/07/01/world/europe/ap-eu-turkey-pride.html	2018-07-01T09:05:59+0000	Turkey's lesbian, gay, bisexual, trans and intersex activists gathered Sunday for an LGBTI pride march in Istanbul, moving from street to street for an hour as police tried to end an event the local government had banned for the fourth year in a r...
World	https://www.nytimes.com/2018/07/01/world/americas/mexico-elections-what-to-watch-for.html	2018-07-01T09:00:04+0000	Sunday’s vote will be a referendum on rampant violence and corruption in hopes that new leadership can guide the nation out of its frustrating stasis.
World	https://www.nytimes.com/aponline/2018/07/01/world/europe/ap-eu-britain-wildfire.html	2018-07-01T08:54:00+0000	Some 120 firefighters are trying to contain a wildfire that has been declared a "major incident" as it spreads in the moorlands of northern England.
World	https://www.nytimes.com/aponline/2018/07/01/world/asia/ap-as-maldives-politics.html	2018-07-01T08:53:59+0000	The opposition alliance in the Maldives has named a backup candidate for the presidential election later this year, in the event the exiled former president is unable to contest due to legal obstacles.
World	https://www.nytimes.com/reuters/2018/07/01/world/middleeast/01reuters-mideast-crisis-syria-drones.html	2018-07-01T08:45:17+0000	Unidentified drones have been shot down near Russian Hmeimim air base in Syria, RIA news agency cited an air base spokesman as saying on Sunday.
World	https://www.nytimes.com/aponline/2018/07/01/world/middleeast/ap-ml-yemen.html	2018-07-01T08:27:05+0000	The Saudi-led coalition fighting Shiite rebels in Yemen has "paused" its campaign to retake the rebel-held port city of Hodeida in support of U.N. peace efforts, an Emirati official said Sunday.
World	https://www.nytimes.com/reuters/2018/07/01/world/asia/01reuters-india-bus-accident.html	2018-07-01T08:06:18+0000	Forty eight people were killed and eleven injured when an overcrowded bus spun off a slippery road and fell into a deep ravine in the northern Indian state of Uttarakhand on Sunday, police said.
World	https://www.nytimes.com/aponline/2018/07/01/world/asia/ap-as-afghanistan.html	2018-07-01T08:05:59+0000	A suicide bomber targeted a convoy of Sikhs and Hindus on their way to meet Afghanistan's president in the eastern city of Jalalabad on Sunday, killing at least 19 people.
World	https://www.nytimes.com/reuters/2018/07/01/world/asia/01reuters-afghanistan-security-school.html	2018-07-01T07:54:22+0000	Unidentified gunmen beheaded three men and torched a boys' school in Nangarhar province in eastern Afghanistan late on Saturday, in an attack officials blamed on Islamic State militants.
World	https://www.nytimes.com/reuters/2018/07/01/world/middleeast/01reuters-mideast-crisis-syria-talks.html	2018-07-01T07:45:18+0000	A major insurgent-held town in southwestern Syria has accepted the return of President Bashar al-Assad's rule, pro-government media and a war monitor said on Sunday, though some local activists and rebels disputed a deal had been completed. 
World	https://www.nytimes.com/reuters/2018/07/01/world/middleeast/01reuters-afghanistan-iran.html	2018-07-01T07:33:18+0000	Aziz Ahmad is one of the unlikely winners of the stand-off between the United States and Iran, turning his modest transport service into an international foreign exchange operation that is providing much-needed dollars to the stricken Iranian econ...
World	https://www.nytimes.com/reuters/2018/07/01/world/middleeast/01reuters-turkey-security-northerniraq.html	2018-07-01T07:33:17+0000	The Turkish military killed eight Kurdish militants in air strikes in northern Iraq and southeastern Turkey at the weekend, it said on Sunday.
World	https://www.nytimes.com/aponline/2018/07/01/world/asia/ap-as-pakistan-cardinal.html	2018-07-01T07:29:58+0000	Pakistan's Christians have welcomed the elevation of Archbishop Joseph Coutts to cardinal.
World	https://www.nytimes.com/aponline/2018/07/01/world/europe/ap-eu-france-pantheon-simone-veil.html	2018-07-01T07:20:59+0000	Holocaust survivor Simone Veil, who repeatedly broke barriers for women in French politics and spearheaded the fight to legalize abortion, was buried at the Pantheon on Sunday, an honor reserved for French heroes.
World	https://www.nytimes.com/aponline/2018/07/01/world/asia/ap-as-india-bus-accident.html	2018-07-01T07:05:59+0000	At least 48 people were killed on Sunday when an overcrowded bus plunged off a mountain road into a gorge in northern India, officials said.
World	https://www.nytimes.com/2018/07/01/world/americas/mexico-election-assassinations.html	2018-07-01T07:00:06+0000	At least 136 politicians have been assassinated in Mexico since last fall. “You have to be a little crazy to run for office here,” a party official said.
World	https://www.nytimes.com/reuters/2018/07/01/world/asia/01reuters-india-crime-delhi.html	2018-07-01T06:30:20+0000	Eleven members of a family were found dead in India's capital on Sunday, most of them hanging from the ceiling of their home, blindfolded, gagged and with hands tied behind the back, with police unable to offer any concrete explanation about what ...
World	https://www.nytimes.com/reuters/2018/07/01/world/middleeast/01reuters-iraq-election-blast.html	2018-07-01T06:24:22+0000	One person was killed in Iraq's Kirkuk on Sunday when a suicide car bomb went off near a storage site housing ballot boxes from a May national election, police sources said, two days before a manual recount was due to begin.
World	https://www.nytimes.com/aponline/2018/07/01/world/middleeast/ap-ml-iran.html	2018-07-01T05:35:59+0000	Gunfire erupted as Iranian security forces confronted protesters early Sunday amid demonstrations over water scarcity in the country's south, violence that authorities said wounded at least 11 people, mostly police.
World	https://www.nytimes.com/reuters/2018/07/01/world/asia/01reuters-thailand-accidents-cave.html	2018-07-01T05:33:13+0000	Thai navy divers had still to navigate their way through three kilometers (nearly 2 miles) of dark, flooded cave passages on Sunday to reach the spot rescuers believe would give 12 missing boys and their soccer coach a better chance of survival.
World	https://www.nytimes.com/reuters/2018/07/01/world/americas/01reuters-mexico-election.html	2018-07-01T05:06:12+0000	Andres Manuel Lopez Obrador decisively won Mexico's presidency on Sunday, exit polls showed, setting the stage for the most left-wing government in decades at a time of tense relations with the Trump administration.
World	https://www.nytimes.com/aponline/2018/07/01/world/asia/ap-as-india-bodies-found.html	2018-07-01T04:27:06+0000	Police in India's capital said they found 11 bodies at a home under mysterious circumstances on Sunday, including 10 that were blindfolded and hanging.
World	https://www.nytimes.com/aponline/2018/07/01/world/asia/ap-as-thailand-cave-search.html	2018-07-01T04:17:59+0000	Rescue divers on Monday were making progress through a key passageway inside the flooded mountain cave in northern Thailand where 12 boys and their soccer coach have been missing for more than a week.
World	https://www.nytimes.com/aponline/2018/07/01/world/americas/ap-lt-mexico-elections.html	2018-07-01T04:12:05+0000	Furious at spiraling corruption and violence, Mexican voters unleashed a political earthquake Sunday by electing a leftist firebrand as president and giving him a broad mandate to overthrow the political establishment and govern for the poor.
World	https://www.nytimes.com/aponline/2018/07/01/world/americas/ap-lt-mexico-presidential-candidates.html	2018-07-01T04:08:59+0000	Four candidates are in the race to become Mexico's next president in Sunday's election. Here's a glance at the hopefuls:
World	https://www.nytimes.com/aponline/2018/07/01/world/americas/ap-lt-mexico-elections-glance.html	2018-07-01T04:06:02+0000	Mexicans will elect a new president and numerous other officeholders on Sunday. With popular discontent high due to high murder rates and rampant corruption, all four candidates are trying to convince voters that they represent change from the sta...
World	https://www.nytimes.com/aponline/2018/06/30/world/asia/ap-as-hong-kong-handover-anniversary.html	2018-07-01T03:45:12+0000	Police in Hong Kong stopped about 20 pro-democracy protesters from getting near a flag-raising ceremony Sunday marking the anniversary of the city's handover from Britain to China.
World	https://www.nytimes.com/reuters/2018/06/30/world/asia/30reuters-northkorea-southkorea-maritime.html	2018-07-01T03:33:20+0000	North and South Korea reopened a maritime communication channel on Sunday, with vessels from the two countries making radio contact for the first time in a decade, South Korea's Defence Ministry said in a statement.
World	https://www.nytimes.com/reuters/2018/06/30/world/asia/30reuters-northkorea-china.html	2018-07-01T03:12:16+0000	North Korean leader Kim Jong Un asked Chinese President Xi Jinping during a meeting in Beijing in June to work towards bringing an early end to economic sanctions imposed on his country, Japan's Yomiuri newspaper reported on Sunday.
World	https://www.nytimes.com/reuters/2018/06/30/world/asia/30reuters-hongkong-anniversary.html	2018-07-01T03:09:15+0000	Pro-democracy activists in Hong Kong were expecting tens of thousands of people to attend an annual protest rally on Sunday to mark the 21st anniversary of the city's return to Chinese rule as tensions simmer over Beijing's tightening grip. 
World	https://www.nytimes.com/reuters/2018/06/30/world/middleeast/30reuters-afghanistan-iran.html	2018-07-01T02:09:17+0000	Aziz Ahmad is one of the unlikely winners of the stand-off between the United States and Iran, turning his modest transport service into an international foreign exchange operation that is providing much-needed dollars to the stricken Iranian econ...
World	https://www.nytimes.com/aponline/2018/06/30/world/asia/ap-as-asia-trade.html	2018-07-01T01:15:11+0000	Trade ministers and officials from 16 Asian countries agreed Sunday to speed up negotiations on outstanding issues and reach a basic agreement on a regional trade pact by the end of this year.
World	https://www.nytimes.com/reuters/2018/06/30/world/europe/30reuters-europe-migrants-germany-merkel.html	2018-06-30T22:30:13+0000	German Chancellor Angela Merkel's political future rests in the hands of the Christian Social Union (CSU) on Sunday, when the Bavarian party's leadership meets to decide whether to accept migration deals she brought back from Brussels.
World	https://www.nytimes.com/reuters/2018/06/30/world/americas/30reuters-mexico-violence.html	2018-06-30T21:27:13+0000	A Mexican journalist was murdered in the southern state of Quintana Roo, authorities said on Saturday, in the latest case of a reporter being killed before a presidential election riddled with violence.
World	https://www.nytimes.com/aponline/2018/06/30/world/europe/ap-soc-wcup-messi-ronaldo-exit.html	2018-06-30T21:27:01+0000	Lionel Messi stared, hands on hips, pain etched across a face once boyish and filled with limitless joy, now obscured by a brown beard and hardened by expectations for his nation unmet.
World	https://www.nytimes.com/aponline/2018/06/30/world/americas/ap-lt-mexico-elections.html	2018-06-30T21:11:59+0000	Mexicans indulged Saturday in a much-needed break from the political propaganda that has engulfed them for months leading up to elections that could usher in big changes for the country.
World	https://www.nytimes.com/reuters/2018/06/30/world/europe/30reuters-europe-migrants-germany-poland.html	2018-06-30T20:51:22+0000	Poland has not entered into any agreement about repatriating asylum seekers, Foreign Ministry spokesman said after a German government document was circulated saying Warsaw was one of 14 governments that had indicated it would be prepared to do so...
World	https://www.nytimes.com/2018/06/30/world/middleeast/syria-jordan-border-daraa.html	2018-06-30T20:18:37+0000	The situation was deteriorating along the border between Syria and Jordan where thousands fled after a new offensive began in the southern city of Dara'a.
World	https://www.nytimes.com/aponline/2018/06/30/world/americas/ap-cb-puerto-rico-helicopter-crash.html	2018-06-30T19:48:00+0000	One person has died after a private helicopter crashed on a beach along Puerto Rico's north coast.
World	https://www.nytimes.com/reuters/2018/06/30/world/europe/30reuters-europe-migrants-ship-standoff.html	2018-06-30T19:09:56+0000	A rescue boat saved 59 migrants at sea off Libya on Saturday and Italy immediately said it would not welcome them, setting up a fresh stand-off with Malta and adding to tensions among European governments over immigration.
World	https://www.nytimes.com/aponline/2018/06/30/world/europe/ap-eu-france-iran-giuliani.html	2018-06-30T19:06:05+0000	Rudy Giuliani has strongly criticized European democracies' will to maintain the Iran nuclear deal after the U.S. decision to pull out from the accord.
World	https://www.nytimes.com/reuters/2018/06/30/world/africa/30reuters-southsudan-unrest.html	2018-06-30T18:36:37+0000	South Sudanese government forces and rebels launched attacks on each other's positions on Saturday, both sides said, the day a ceasefire that formed part of new peace agreement was due to take effect.
World	https://www.nytimes.com/reuters/2018/06/30/world/asia/30reuters-malaysia-politics-umno.html	2018-06-30T18:33:45+0000	Malaysia's former ruling party picked a familiar face as its new leader on Saturday, as they grapple with a spectacular defeat in a May general election that pushed them from power after more than 60 years.
World	https://www.nytimes.com/reuters/2018/06/30/world/middleeast/30reuters-mideast-crisis-syria-jordan.html	2018-06-30T18:00:41+0000	The Jordanian army began delivering humanitarian aid to thousands of displaced Syrians who took shelter near its border when major fighting broke out in southern Syria this month, a government spokeswoman said on Saturday.
World	https://www.nytimes.com/aponline/2018/06/30/world/middleeast/ap-ml-palestinians-.html	2018-06-30T18:00:19+0000	The Palestinian Health Ministry in Gaza says a mysterious explosion has killed two residents and injured eight others, three seriously.
World	https://www.nytimes.com/aponline/2018/06/30/world/middleeast/ap-ml-yemen.html	2018-06-30T17:54:04+0000	Yemen's government says the political solution to the country's civil war begins with the "complete and unconditional" withdrawal of rebels from the port city of Hodeida.
World	https://www.nytimes.com/reuters/2018/06/30/world/asia/30reuters-malaysia-child-marriage.html	2018-06-30T17:21:48+0000	Reports of marriage between a 11-year old girl and a man 30 years her senior sparked an uproar in Malaysia on Saturday, reigniting debate on the subject of underage marriage in the Muslim majority country.
World	https://www.nytimes.com/aponline/2018/06/30/world/asia/ap-as-india-rape.html	2018-06-30T17:14:59+0000	Hundreds of people on Saturday blocked streets and shut down businesses in parts of central India to protest the rape of a 7-year-old girl.
World	https://www.nytimes.com/aponline/2018/06/30/world/europe/ap-eu-europe-migrants-the-latest.html	2018-06-30T17:03:03+0000	The Latest on migration into Europe (all times local):
World	https://www.nytimes.com/reuters/2018/06/30/world/middleeast/30reuters-iran-nuclear-opposition-giuliani.html	2018-06-30T17:00:51+0000	U.S. President Donald Trump will suffocate Iran's "dictatorial ayatollahs", his close ally Rudy Giuliani said on Saturday, suggesting his move to re-impose sanctions was aimed squarely at regime change.
World	https://www.nytimes.com/reuters/2018/06/30/world/africa/30reuters-uganda-crime.html	2018-06-30T17:00:41+0000	The ambassadors of the United States and France joined dozens of Ugandan demonstrators in the capital Kampala on Saturday to protest against what they say is rising violence against women, including murder, rape and kidnapping for ransom.
World	https://www.nytimes.com/aponline/2018/06/30/world/europe/ap-soc-wcup-france-argentina.html	2018-06-30T16:18:07+0000	What Lionel Messi has never done, 19-year-old Kylian Mbappe did twice.
World	https://www.nytimes.com/reuters/2018/06/30/world/europe/30reuters-britain-fire.html	2018-06-30T16:09:17+0000	Fires on moorland outside the northern English city of Manchester intensified on Saturday, prompting authorities to declare a major incident.
World	https://www.nytimes.com/aponline/2018/06/30/world/europe/ap-eu-albania-ministers-driver.html	2018-06-30T15:54:09+0000	Albanian police are reporting that the driver for the interior minister has been found shot dead.
World	https://www.nytimes.com/reuters/2018/06/30/world/americas/30reuters-mexico-election-candidates.html	2018-06-30T15:39:21+0000	Millions of Mexicans will go to the polls on Sunday to choose a new president. The four main candidates have sparred over key issues of corruption, security and the economy.
World	https://www.nytimes.com/aponline/2018/06/30/world/africa/ap-af-ethiopia-terror-list.html	2018-06-30T15:27:23+0000	Ethiopia's cabinet has passed a resolution to remove three armed groups from a terror list as part of sweeping reforms under a new prime minister. The groups, operating mainly from neighboring Eritrea, had opposed the government that ruled Ethiopi...
World	https://www.nytimes.com/reuters/2018/06/30/world/americas/30reuters-mexico-election-candidates-factbox.html	2018-06-30T15:27:21+0000	Millions of Mexicans will go to the polls on Sunday to choose a new president. The four main candidates have sparred over key issues of corruption, security and the economy.
World	https://www.nytimes.com/reuters/2018/06/30/world/europe/30reuters-europe-migrants-germany-hungary.html	2018-06-30T15:21:30+0000	A spokesman for Hungary's government on Saturday said it has not entered into any agreement about repatriating asylum seekers after a German government document was circulated saying Budapest was one of 14 governments that had had indicated it wou...
World	https://www.nytimes.com/2018/06/30/world/africa/south-sudan-cease-fire-violated-within-hours.html	2018-06-30T14:50:49+0000	Troops violated South Sudan’s latest cease-fire just hours after it began at midnight, with both sides blaming the other for instigating attacks.
World	https://www.nytimes.com/2018/06/30/world/europe/belgium-brussels-congo-patrice-lumumba.html	2018-06-30T14:39:57+0000	The renaming of a Brussels square after Patrice Lumumba, first prime minister of independent Congo, is a symbolic step in a sometimes tortured post-colonial history.
World	https://www.nytimes.com/aponline/2018/06/30/world/asia/ap-as-japan-rocket-explosion.html	2018-06-30T13:57:00+0000	A rocket developed by a Japanese startup company burst into flames seconds after a failed liftoff Saturday in northern Japan.
World	https://www.nytimes.com/aponline/2018/06/30/world/europe/ap-eu-britain-health-care.html	2018-06-30T13:51:01+0000	Britain's National Health Service has proposed cutting back on operations including breast reductions and anti-snoring treatments as part of plans to save money and reduce "unnecessary or risky procedures."
World	https://www.nytimes.com/reuters/2018/06/30/world/middleeast/30reuters-mideast-crisis-syria-talks.html	2018-06-30T13:42:15+0000	Syrian rebels meeting Russian officers in a southern Syrian town on Saturday said negotiations for a peace deal with the government ended in failure after they rejected Moscow's demands to surrender, their spokesman said.
World	https://www.nytimes.com/aponline/2018/06/30/world/middleeast/ap-ml-iraq.html	2018-06-30T13:39:04+0000	Iraq's national elections commission says a hand recount of the vote from last May's parliamentary elections will start on Tuesday.
World	https://www.nytimes.com/reuters/2018/06/30/world/middleeast/30reuters-egypt-politics.html	2018-06-30T13:21:14+0000	President Abdel Fattah al-Sisi said on Saturday Egypt was on the "right track" to rebuild its economy after years of instability that had nearly brought the country to its knees.
World	https://www.nytimes.com/aponline/2018/06/30/world/middleeast/ap-ml-egypt-economy.html	2018-06-30T12:38:59+0000	Egypt's President Abdel-Fattah el-Sissi urged citizens on Saturday to further endure economic reforms and austerity measures, including a recent wave of steep price hikes on fuel, electricity and drinking water.
World	https://www.nytimes.com/aponline/2018/06/30/world/europe/ap-eu-poland-obit-szewinska.html	2018-06-30T12:30:07+0000	Irena Szewinska, a Polish sprinter who dominated women's athletics for two decades, winning seven Olympic medals, and who later became a member of the International Olympic Committee, has died at 72.
World	https://www.nytimes.com/reuters/2018/06/30/world/europe/30reuters-soccer-worldcup-crash.html	2018-06-30T12:12:19+0000	An Indian soccer fan, in Russia for the World Cup, died in a car crash on Saturday on a road near the tournament host city Sochi, Interfax news agency cited sources as saying. 
World	https://www.nytimes.com/aponline/2018/06/30/world/europe/ap-eu-austria-eu-presidency.html	2018-06-30T12:11:59+0000	Austria has taken over the rotating presidency of the European Union with a pledge to better secure the 28-nation bloc's external borders.
World	https://www.nytimes.com/reuters/2018/06/30/world/americas/30reuters-mexico-election-democracy.html	2018-06-30T12:09:22+0000	Mexican voters will stream to the polls this Sunday in a pivotal presidential contest, but leaders representing tens of thousands of indigenous people have vowed to block voting in their communities to protest a system they say has failed them.
World	https://www.nytimes.com/reuters/2018/06/30/world/middleeast/30reuters-iraq-election.html	2018-06-30T12:09:20+0000	Iraq will begin a manual recount of votes on Tuesday from a May parliamentary election clouded by allegations of fraud, a step towards the formation of a new parliament and government.
World	https://www.nytimes.com/reuters/2018/06/30/world/europe/30reuters-europe-migrants-germany.html	2018-06-30T11:57:12+0000	German Chancellor Angela Merkel's political future rests in the hands of the Christian Social Union (CSU) on Sunday, when the Bavarian party's leadership meets to decide whether to accept migration deals she brought back from Brussels.
World	https://www.nytimes.com/aponline/2018/06/30/world/europe/ap-eu-estonia-us-ambassador.html	2018-06-30T11:57:02+0000	The U.S. ambassador to Estonia has resigned over frustrations with President Donald Trump's comments about the European Union and his treatment of Washington's European allies.
World	https://www.nytimes.com/reuters/2018/06/30/world/europe/30reuters-czech-government.html	2018-06-30T11:45:15+0000	The Czech Communist Party agreed on Saturday to help a minority cabinet led by Prime Minister Andrej Babis survive a vote of confidence, clearing the way for the billionaire businessman to govern after winning an election in October.
World	https://www.nytimes.com/aponline/2018/06/30/world/europe/ap-soc-wcup-nizhny-closed-city.html	2018-06-30T11:33:04+0000	It's hard to fathom for 21-year-old Valeria Kashnikova as she delivers pizzas to tables jammed with Swedes, Croats, and Argentines that her Russian city was closed to foreigners for almost 60 years during the Soviet Union era.
World	https://www.nytimes.com/aponline/2018/06/30/world/asia/ap-as-pakistan-mountaineers.html	2018-06-30T11:30:07+0000	One member of a three-man mountaineering expedition has died in an avalanche on a more than 7,000-meter (7,658-yard) high peak in northern Pakistan, officials said Saturday.
World	https://www.nytimes.com/reuters/2018/06/30/world/asia/30reuters-india-rape.html	2018-06-30T11:27:24+0000	Thousands of people took to the streets in central India this week demanding the death penalty for assailants who raped a seven-year-old girl lured away from school as she waited to be picked up by her parents.
World	https://www.nytimes.com/aponline/2018/06/30/world/europe/ap-soc-wcup-booming-business.html	2018-06-30T11:27:04+0000	Moscow's beer kegs are emptying fast and demand for Vladimir Putin T-shirts is overwhelming St. Petersburg street vendors as the World Cup sends business surging across the 11 Russian cities hosting soccer's biggest show.
World	https://www.nytimes.com/reuters/2018/06/30/world/europe/30reuters-turkey-security.html	2018-06-30T11:24:18+0000	The Turkish military carried out airstrikes in northern Iraq's Avasin Basyan region on Saturday, killing four Kurdish militants, it said on its official Twitter account.
World	https://www.nytimes.com/aponline/2018/06/30/world/europe/ap-eu-europe-migrants.html	2018-06-30T11:24:04+0000	The full moon was the only light as a terrified 9-year-old boy from Central African Republic climbed into a rubber dinghy held together with duct tape, risking death in the dark waters off Libya along with his parents and 57 other trafficked migra...
World	https://www.nytimes.com/aponline/2018/06/30/world/europe/ap-eu-france-czech-slovakia.html	2018-06-30T11:08:59+0000	Leaders of France, the Czech Republic and Slovakia have met in Paris to commemorate the centenary of the creation of the Czechoslovakia military, which prompted the country's independence from the Austro-Hungarian Empire.
World	https://www.nytimes.com/aponline/2018/06/30/world/middleeast/ap-ml-iran-us-protest.html	2018-06-30T11:03:04+0000	Iran's Supreme Leader has accused the United States and allies of fomenting unrest in Iran.
